,id,show_id,title,link,guid,subtitle,description,summary,author,audio_url,audio_file_size,audio_mime_type,category,explicit,length,pub_date,keywords
268,406bad5b-257a-3e0c-8507-82d09766a647,5cac948d-55b5-3d0e-9b66-899e2bf04cc7,delete scene good bad idea storybrooke sale rumbelle honeymoon mansion find white main show,http://feedproxy.google.com/~r/ouatpodcast/~3/_PAq5uyPcSo/,http://www.onceuponatimepodcast.com/?p=8199,subscribe via itune rss stitcher main show prerec intro intro episode name white main show episode number show note find teaser point magic upon time con,p subscribe via itune rss stitcher main show prerec intro intro episode name white main show episode number show note find teaser point magic upon time,br subscribe via itunesshownotes rss stitcher main show br prerec intro br episode name white main show br episode number br show note find teaser magic upon time affect nikka fish new shop main street steveston br find possible place mail wedding gift newlywed br marvelish prize hurry br snow queen delete scene side bo peep br storybrooke realty problem br steveston bluebird chirp br interested buy storybrooke public library aka nikka fishing marine go close end oct link news nikka fishing marine close news nikka fishing marine close accord local paper city look nikka building get possible site steveston library expansion br look like office move steveston well least exterior wall exterior wall build parking lot behind purbeck also look like pajos fish chip float dock waterfront become storybrooke fish chip around time film inside tapenade bistro may recognize interior make least filming cedar cove series film north deep cove area cove grumpy sailboat honeymoon house rumple belle look lot like cecil green house university british columbia campus attach picture br br br picture give take mid july see doorway still use prop storage case pet right next law office japanese fusion restaurant real life formerly east indian restaurant signage doorway lead inside several separate office one dentist maybe aptly br usual building change along storybrooke cannery make infrequent notice large sign building housing diner interested think heritage build much change exterior way go ouat may buy whole smart like iron man smashingly heroic like hulk mighty like thor brave like black widow leader like captain america loyal like falcon responsible like spider man skilled like iron spider strong like gamora inventive like rocket maybe quality aspire bring inner super hero chance win one many marvel relate prize thru october consumer enter marvel super hero september sweepstake chance win grand pri,"Jeff Roney and Colleen Roney, Once Upon a Time Reviewers, Hosts.",http://feedproxy.google.com/~r/ouatpodcast/~5/w70Ep6u7cjg/WhiteOutMainShow.mp3,22561176,audio/mpeg,white out,0,280,2014-10-12 07:51:29 UTC,
269,301c3f2a-ddb6-3c78-91ab-f0319a094da7,00454ad5-2402-3a4f-b4ff-3c726b9a7b4a,accept god want,,http://www.buzzsprout.com/690/36303-accepting-what-god-wants.mp3,,,,Pastor Tony Scheving,http://www.buzzsprout.com/690/36303-accepting-what-god-wants.mp3,17758336,audio/mpeg,,0,2219,2011-11-28 03:00:00 UTC,accept surrender submit blood sword prayer flesh might cup disciple
270,364c0e0f-9fc0-3ff8-8c2a-1bd3e751bb2c,3ae2c5d8-6039-3691-b698-079159b503ca,show case barack obama unlikely rise unexamined agenda medve interview audio,http://traffic.libsyn.com/acu/medved_Obama_book.mp3,http://americanconservativeuniversity.com/index.php?post_id=371244#,show case barack obama unlikely rise unexamined agenda medium favorite candidate medve interview author audio show michael medve talk author david freddoso book case barack,p show case barack obama unlikely rise unexamined agenda medium favorite candidate medve interview author audio p show michael medve talk author david freddoso book case barack,,,http://traffic.libsyn.com/acu/medved_Obama_book.mp3?dest-id=13100,8594578,audio/mpeg,,0,2148,2008-08-25 07:00:00 UTC,
271,6e326c88-5178-3c95-a887-f66f2020056d,4485eafd-bb9b-35e6-9d2c-8ecef6a4e045,episode crest terrible person,https://soundcloud.com/lostintranslationmon/episode-72-the-crest-of-not-being-a-terrible-person,"tag:soundcloud,2010:tracks/287759728",jay start like juri may annoy separa,jay start like juri may annoy separation use plot point dog go woof linkdump screenshot week may hold terriermon way,jay start like juri may annoy separation use plot point dog go woof linkdump screenshot week may hold terriermon way jay oorochimon weekly wonder may learn japanese pod jay shogun novel thank supporter patreon sam krieger host digimon pokemon podcast stevie call moncast wuqinglong follow twitch name metalmamemon joe chakmon ishpaul bhamber hiro alato jason morosky frostmrajic steven reeve kaida washi mac noam riku red garren breakfast digimon jam become patreon supporter little dollar per month love forever also donate production podcast use paypal segment intro diginew lose newslatelymon obnoxious synopsis episode discussion episode opinion episode discussion episode opinion overall opinion postmon pat rumble arena war digital world outro youtube gmail reddit tumblr twitter facebook soundcloud itune stitcher,"May Fisher-Guest and Rohan ""Jay"" Ajzensztat",http://feeds.soundcloud.com/stream/287759728-lostintranslationmon-episode-72-the-crest-of-not-being-a-terrible-person.mp3,104927816,audio/mpeg,,0,3078,2016-10-14 22:30:32 UTC,
272,6a272bf9-04eb-333a-a4c0-ddd4e0b4f8bf,75da06c6-7c1a-351d-883c-ec7110a65ab0,ten investment true wealth rich life beau henderson,http://entrepreneuronfire.libsyn.com/1158-ten-investments-for-true-wealth-and-the-rich-life-with-beau-henderson,82f99e88581756dbcc5083d280204694,visit,p visit,,,http://traffic.libsyn.com/entrepreneuronfire/Beau_Henderson.mp3?dest-id=100507,11178573,audio/mpeg,,0,1375,2015-12-23 08:30:00 UTC,
273,dae094f4-d948-3cc8-94a2-c2d86a1b051c,c8c0074c-6b82-30d6-8993-f6c6eb7aa027,thirsty,http://www.myfaithfamily2.com/podcasts/united/199/199-04.mp3,,thirsty united,,,Noah Nickel,http://www.myfaithfamily2.com/podcasts/united/199/199-04.mp3,25442472,audio/mpeg,,0,1791,2015-05-30 08:00:00 UTC,
274,86066772-998e-3848-802a-16bfe11a2058,3adf8f98-f319-3e49-b67a-768587123688,talk dead eye care,http://feedproxy.google.com/~r/talkingdead/~3/MqZAEHv2R5o/,http://www.talkingdeadpodcast.com/?p=1037,episode podcast jason get catch quick bit walk dead news complete melissa mcbride actor spotlight also one far movie review thank listen week,episode podcast jason get catch quick bit walk dead news complete melissa mcbride actor spotlight also one far movie review thank listen week please visit we p,episode podcast jason get catch quick bit walk dead news complete melissa mcbride actor spotlight also one far movie review thank listen week please visit we patreon make small monthly pledge forget,Chris & Jason,http://media.blubrry.com/talkingdead/traffic.libsyn.com/thetalkingdead/thetalkingdead_170.mp3,54287351,audio/mpeg,Podcast,1,999,2014-07-22 04:53:27 UTC,
275,d603321c-6e71-3aa2-844b-81c9b9b4b866,9ac7c94e-a451-3f09-b006-be4506d3bd63,pasture poultry backyard,http://www.ahappyhomemedia.com/2011/06/pastured-poultry-from-your-backyard/,http://ahappyhomemedia.com/2011/06/17/pastured-poultry-from-your-backyard/,podcast husband share raise butcher meat hen grow farming expert help internet attitude happy result,podcast husband share raise butcher meat hen grow farming expert help internet attitude happy result believe,podcast husband share raise butcher meat hen grow farming expert help internet attitude happy result believe,Podcast – A Happy Home Media,http://feedproxy.google.com/~r/AHappyHomePodcast/~5/OwSkUwA1F24/022-HHP-061711.mp3,17009227,audio/mpeg,poultry,0,2122,2011-06-17 21:12:00 UTC,god jesus family homesteading homeschooling homemaking syndrome christian mother child bible
276,059e48fd-8c1f-322d-abe3-0eea51e74ae8,4ae8d113-a60a-383e-98d3-76a61b36d54d,rescue child life brothel,http://themissionsnetwork.com/index.php?option=com_preachit&view=study&mode=watch&id=624:rescuing-children-from-a-life-in-a-brothel,http://themissionsnetwork.com/index.php?option=com_preachit&view=study&mode=watch&id=624:rescuing-children-from-a-life-in-a-brothel,cicm long active ministry rescue child slavery learn passion child open door rescue child brothel,cicm long active ministry rescue child slavery learn passion child open door rescue child brothel,cicm long active ministry rescue child slavery learn passion child open door rescue child brothel,CICM,http://themissionsnetwork.com/video2014/Brothel_Children.mp4,15855545,video/mpeg,,0,196,2014-04-03 13:45:11 UTC,mission christianity mission network missionary restoration movement mission
277,af961334-1c45-3941-bdf4-3c039c513f8c,2bba9073-5c3b-3ffb-94f7-c7c8a8c9bc0d,locker room talk world bad boss donald trump prison dog pumpkin spice product,http://satellitesisters.libsyn.com/locker-room-talk-worlds-worst-boss-donald-trump-prison-dogs-and-pumpkin-spice-products,c9104e79094531cd6aedb2102b84fba0,liz julie lian bend film festival restaurant sticky situation,p lian dolan liz dolan julie dolan satellite sister podcast show week suffer post debate aftermath liz ask satellite sister locker room talk would sound like julie suggest newscation p l,,,http://www.podtrac.com/pts/redirect.mp3/traffic.libsyn.com/satellitesisters/ss101116.mp3?dest-id=63293,33875092,audio/mpeg,,0,754,2016-10-11 19:45:28 UTC,film donald dog pumpkin festival trump gender bias bend prison spice
278,281a8975-ef60-35c2-8fb6-2800b184c7ae,95375af3-f343-3053-b75b-4e485f30c173,thankful heart overflow audio,http://calvarybcpreble.sermon.net/10623947,http://calvarybcpreble.sermon.net/10623947/controller/link/action/podcast/type/audio_athankfulheartoverflows/id/1425976.mp3,look paul thank note see paul testimony transparency thank god,look paul thank note see paul testimony transparency thank god,look paul thank note see paul testimony transparency thank god,Tim Mowers,http://calvarybcpreble.sermon.net/10623947/controller/link/action/podcast/type/audio_athankfulheartoverflows/id/1425976.mp3,10582921,audio/mpeg,,0,2634,2014-01-19 01:00:00 UTC,thankfulness heart testimony transparency series book philippians custom category pastor tim mower
279,d6073ce3-18dc-3719-b936-8ad25ea2e1c9,ac29473f-81cd-3ed1-9bc3-3c9c67c4329c,guntalk part,http://guntalk.libsyn.com/guntalk-2011-07-31-part-a,e8ec00bc9d802534ee896fa099786739,gun talk national radio show,p hour one guest span coat liberty,,,http://traffic.libsyn.com/guntalk/110731guntalkA.mp3?dest-id=12214,10770669,audio/mpeg,,0,2675,2011-07-31 19:57:28 UTC,second gun shooting firearm amendment sport
280,f1cb88e8-b24b-3451-be58-2ef5c684b011,3c6be1b3-dc7d-319e-aead-19d0cfb98432,fsbreak one hundred dollar hamburger x plane first week ade update simflight,http://feedproxy.google.com/~r/fsbreak/~3/mbAY8Rr5PnA/15,http://www.fsbreak.net/?p=621,host eric mcclintock nolan mark listen subscribe automatically get late podcast itune zune rss xml e mail simflight,host eric mcclintock nolan subscribe automatically get late podcast itune zune rss xml e mail simflight releasedit four seat single engine high wing airplane capable cru,host eric mcclintock nolan mark listen subscribe automatically get late podcast itune zune rss xml e mail simflight release four seat single engine high wing airplane capable cruise knot original model ship horsepower cylinder engine consider popular flight training airplane world still produce today aircraft build feature first professionally produce classic straight tail optimize fsx work highly detailed virtual cockpit gps localizer glideslope door window engine compartment open oil check full ifr ready panel include checklist performance information paint scheme price information link via link screenshot nggallery airport design editor update airport design editor graphical design tool create enhance airport microsoft flight simulator take inspiration excellent develop lee swordy ade fsx afcad add support new fsx feature fence jetway terrain ade develop help small group dedicated airport designer wealth knowledge experience version feature major new function visual approach designer past create approach mean write xml code repeatedly check fs version introduce graphical interface approach design mimic fsx gps display ade available free download author website full feature list find information ade look link via link x plane first impression eye candy like move traffic road like fsx think add lot realism power line think add realism mix ai train runway slope terrain something msfs struggle time night airport look incredible feature like simulator run smooth tend stutter even high autogen call x plane area water wave configuration key combo overwhelming first set come handy ability assign macro like function key x plane helipad local hospital even police helicopter station road house x plane ugly joystick control sometimes buggy need reverse certain function seem like need reverse etc still intermittent issue plane veer left default aircraft model suck honestly addon well quality msfs freeware model ex project opensky payware model pmdg etc helicopter control touchy could actually get heli airborne without flip flight physics seem go crazy time example able drop foot cessna go back foot drop foot pull recover second never fly real plane seem likely normal flight physics seem ok adjust weather set precipitation none yet still rain probably miss setting though compare fsx amount addon small airport par msfs example kcvg look like parking space three runway large airport like lax look good though may seem like small feature fsx load real world road datum navteq also supply datum gps maker use recrea,www.fsbreak.net,http://feedproxy.google.com/~r/fsbreak/~5/LW9KkAAYvGY/fsbreak_015.mp3,77519868,audio/mpeg,FSBreak Shows,0,6458,2009-05-06 00:00:19 UTC,fsbreak show
281,b91dd90f-ec72-301b-8621-d7f29516527c,e5b2fa48-5da7-3722-82ca-e3d28b42e85f,october patreon hangout,http://gamersinnpodcast.com/episode/october-2015-patreon-hangout/,http://gamersinnpodcast.com/?p=2454,jocelyn ryan take question patron chat october hangout blast hope would like become patreon gamer inn visit,jocelyn ryan take question patron chat october hangout blast hope would like become patreon gamer inn visit patron submit question,jocelyn ryan take question patron chat october hangout blast hope would like become patreon gamer inn visit patron submit question hangout even join we game night week,Jocelyn and Ryan,http://media.blubrry.com/thegamersinn/gamersinnpodcast.com/wp-content/uploads/podcast/tgi190a-26102015.mp3,54744602,audio/mpeg,Patron,0,3363,2015-10-31 13:12:10 UTC,
282,8f44731c-0d32-37a4-a378-7dbfc66ea431,2ac54175-f4bc-30dc-bed2-104425d15dd1,spring tv preview,http://tvtimesthree.com/tvx3-e263-spring-tv-preview-2015/,http://tvtimesthree.com/?p=1169,episode jason rae join kyle nolan talk renewal news preview spring tv schedule discuss recent episode fresh boat,episode jason rae join kyle nolan talk renewal news preview spring tv schedule discuss recent episode fresh boat hart,,Jason the TVaholic,http://media.blubrry.com/tvtimesthree/content.blubrry.com/tvtimesthree/TVx3_E263.mp3,40734690,audio/mpeg,,0,1605,2015-02-26 01:20:50 UTC,
283,e09dc7f1-fb7d-32ff-a229-c8d8f90b3598,eee96540-d2dd-3a0a-b859-9641d6d87be0,tpv podcast episode check show,http://thepaleoview.podbean.com/e/tpv-podcast-episode-133-check-in-show/,http://thepaleoview.podbean.com/e/tpv-podcast-episode-133-check-in-show/,intro view work big project good opportunity check showstacy receive,ul family georgia time new roman bitstream charter time color align li align view,br intro news view sarah work big project good opportunity check show br stacy receive huge news beyond bacon costco go bacon stock costco store psst announcement include br sarah work call action let get paleo bite paleo cooking show send pitch network br find full detail call action let get paleo bite let network know want show call action let get paleo bite br br stacy sarah great back next week share especially update crossfit open br br br outro,Stacy Toth and Sarah Ballantyne,http://thepaleoview.podbean.com/mf/feed/c7fsaq/ThePaleoViewEpisode133.mp3,14897655,audio/mpeg,Uncategorized,0,1862,2015-03-05 06:26:09 UTC,
284,626924d8-1d2e-370f-b72e-facf33eeaedf,b22c4c92-d1ee-3709-b95b-9f56b20ee67a,mediocre wawa insider,http://www.mediocreshow.com,mediocre-515-wawa-insider,,p record live pm mediocre radio network br rabbit br br bad pumpkin br br martin br br scene wawa br email,record live pm mediocre radio network rabbit rabbit halloween troy bad pumpkin voicemail jimmy martin zombie behind scene wawa live email always hope internet smile vaporking discount code shanty live call number voicemail line twitter streaming provide subscribe scorpion support chance winner mediocre show po box west chester pa mediocre podcast bring following business partner,"eric tomorrow, mike pilot, and hope",http://traffic.libsyn.com/mediocreshow/mediocre515.mp3,116201048,audio/mpeg,,0,2719,2013-11-07 07:39:07 UTC,
285,67a91066-0db4-3392-96e9-601422b3c5d8,0da2f1e1-14c0-31f4-9037-acfbfeb9a3e6,ydhwit good enough,http://feedproxy.google.com/~r/HeartlandCommunityChurchPodcast/~3/AqcOGJWTdgM/To_Be_Good_Enough.mp3,http://podcast.heartland.cc/To_Be_Good_Enough.mp3,take present foundational principle need new year perhaps even new life,teacher mike breaux synopsis new year time set lofty goal push new limit probably feel really guilty week self help program soon realize take control future,teacher mike breaux synopsis new year time set lofty goal push new limit probably feel really guilty week self help program soon realize take control future please everyone good enough handle everything want need help source big self take present foundational principle need new year perhaps even new life miss single week,Heartland,http://feedproxy.google.com/~r/HeartlandCommunityChurchPodcast/~5/AqcOGJWTdgM/To_Be_Good_Enough.mp3,26904249,audio/mpeg,Christianity,0,1679,2009-01-19 14:01:40 UTC,teaching christianity heartland church breaux
286,b44f899b-d3c6-3e8c-a586-2fd322e059ad,f2993029-30d2-3b9a-94d1-1347802a4907,sys podcast episode founder ceo emily good talk crowdfunde film,http://www.sellingyourscreenplay.com/podcasts/sys-podcast-episode-066-founder-and-ceo-of-seedspark-emily-best-talks-about-crowdfunding-your-film/,http://www.sellingyourscreenplay.com/?p=2503,episode podcast talk emily good find ceo crowdfunding platform specifically design filmmaker emily offer lot practical tip run successful crowdfunding campaign,read podcast sys podcast founder ceo seedspark emily good talk crowdfunding podcast episode founder ceo emily good talk abo,episode podcast talk emily good find ceo crowdfunding platform specifically design filmmaker emily offer lot practical tip run successful crowdfunding campaign podcast available itune youtube stitcher android user windows marketplace blackberry store simply listen watch right blog also read transcript episode link mention show emily well twitter twitter facebook bright idea magazine facebook bright idea magazine facebook crowdfunde resource new sys script consultant service sys email fax blast service sys twitter sys facebook sys youtube free guide sell screenplay week,Ashley Scott Meyers: Screenwriter and blogger at SellingYourScreenplay.com,http://traffic.libsyn.com/asmmedia/SYS-episode-66-Emily-Best.mp3,51433863,audio/mpeg,Seed&Spark,0,3210,2015-03-23 14:00:43 UTC,emily good
287,fd452b48-ae7b-391c-89e8-ae7c0a72689b,f3c641ed-f66c-32d6-8890-7f7aec37e0d8,joy hope chesterton colossians everyday thank,,http://www.buzzsprout.com/18164/196158-joy-in-hope-g-k-chesterton-and-colossians-3-15-everyday-thanks-266.mp3,today thankful joy hope p quote thank chesterton say would maintain thank high form thought gratitude happiness double wonder p bible verse,today thankful joy hope p quote thank chesterton say would maintain thank high form thought gratitude happiness double wonder p bible verse thank c,today thankful joy hope p quote thank chesterton say would maintain thank high form thought gratitude happiness double wonder p bible verse thank colossians read let peace god rule heart also ye call one body ye thankful p p day thanking god thanksgiving ebook dp day thank god daniella available wherever fine book sell include amazon kindle p thank thank devotional,Daniella Whyte,http://www.buzzsprout.com/18164/196158-joy-in-hope-g-k-chesterton-and-colossians-3-15-everyday-thanks-266.mp3,1464448,audio/mpeg,,0,174,2014-08-14 03:00:00 UTC,colossians everyday thank day thank god joy hope chesterton danni whyte gratitude thankfulness thanksgiving gratefulness thankful everyday thank grateful day
288,2c9bdf4b-f343-3743-84a6-c77cb8e5454e,9a2ae4c5-c52b-3753-a1fa-c944fe11398f,clarity bring result,http://crimsoncircle.com/audiohelp.htm,http://crimsoncircle.com/audio/ch120505.mp3,shoud series,channel series,channel series,Crimson Circle,http://crimsoncircle.com/audio/ch120505.mp3,45958190,audio/mpeg,Spirituality,0,2677,2012-05-05 14:30:00 UTC,podcast tobia shoud teacher channel crimson circle adamus saint germain kuthumi metatron
289,fe46fafe-273a-335b-b2f3-0b033824162b,83dd1f0a-3796-3e58-930d-52a3b70fd479,pogoradio sendung vom april,http://www.pogoradio.de/2012/04/julia/,http://www.pogoradio.de/?p=9253,folge zu gast war julia songliste interpret titel album geld et nelt jingle yidcore al kol ele yidcore star fucking hipster ana ng dumpster grave melt banana giggle stretcher charlie,folge zu gast war julia songliste interpret titel album geld et nelt jingle yidcore al kol ele yidcore star fucking hipster ana ng dumpster grave melt banana giggle stretcher charlie chefdenker die w,br folge zu gast war julia br br songliste interpret titel album br et nelt jingle br al kol ele yidcore br starfuckinghipster fucking ana ng dumpster grave br wiki melt banana giggle stretcher charlie br die welt minuten eine von hundert mikrowellen br wiki varför lever du aktion br aktuell ihr seid schön alle gegen alle br parkett jimmy hartwig br,Pogoradio,http://media.blubrry.com/pogoradio/pogoradio.de/2012/20120425_23-00_Pogoradio.mp3,57697657,audio/mpeg,,1,120,2012-04-25 22:30:45 UTC,
290,010483e3-07a5-305f-abea-1019cbb6c998,28b43f4d-f3e2-38b2-99e3-e3b8f6710ce2,autoline button,http://www.autolinedetroit.tv/podcasts/autoline/1310.mp4,D675AA14-7692-4E01-8FE9-3D2408C87609,button,button br br iphone touch screen today find middle design br conventional button use king kitchen computer car increasingly become century,button iphone touch screen today find middle design metamorphosis conventional button use king kitchen computer car increasingly become century version dinosaur replace many touch pad sof touch photoelectric switch week autoline spotlight two man organization bring button back vogue least car first little blue button rearview mirror many general motor vehicle course onstar onstar subscription base communication service cater car driver variety way chet huber company president sit john discuss technology service well bud competition meanwhile button change car audio know belong someone name bongiovi rock star bon jovi second cousin keep original family name become famous record producer right nearly forty year music business tony bongiovi brine engineering prowess car revolutionary breakthrough use software transform standard radio car premium sound system talk john new product also see hear work short demonstration autoline extra hear tony bongiovi fascinating journey music industry motown record plant medium sound power station studio click autoline extra,John McElroy,http://www.autolinedetroit.tv/podcasts/autoline/1310.mp4,110575616,video/mp4,Business/Automotive,0,1484,2009-03-27 16:24:31 UTC,automotive auto car autoline detroit john mcelroy onstar chet huber tony bongiovi general motor
291,34cb3744-ca02-362b-b3e7-53ebe8adbe33,c92dc100-ad50-3b8f-a768-9391201171b8,steve get burglarize,http://ChoiceConversations.com/steve-gets-burglarized,ae5c5cc4f3b3b45c0b5753b669c21d3f,episode talk car break valuable content inside steal move frlom talk physical possession psychological effect violate also expand discussion talk,p episode talk car break valuable content inside steal move frlom talk physical possession psychological effect violate also expand discussion talk,,,http://traffic.libsyn.com/choiceconversations/Episode_94_-_Steve_Gets_Burglarized.mp3?dest-id=35640,43003133,audio/mpeg,,0,2688,2011-05-23 15:56:31 UTC,
292,bf8d9648-15f6-3308-a511-3ad74528d97f,10b1d893-dc35-329a-9340-1aab1a7c3038,dr synthia andrews subtle energy expert episode,http://ideasicle.libsyn.com/ideasicle-podcast-episode-17-dr-synthia-andrews,dd5d4365cc40c9a4f6c91cd704da1c92,fascinating discussion subtle energy influence creativity,p family feel strange vibe room know someone think talk even feel jolt inspiration great idea well today go talk,,,http://traffic.libsyn.com/ideasicle/Ideasicle_Podcast_Episode_17_Dr_Synthia_Andrews.m4a?dest-id=18556,17660439,audio/x-m4a,,0,2150,2011-08-30 16:21:00 UTC,energy life marketing force burn innovation advertising creativity idea path subtle andrew synthia chakra ideation ideasicle
