,id,show_id,title,link,guid,subtitle,description,summary,author,audio_url,audio_file_size,audio_mime_type,category,explicit,length,pub_date,keywords
745,ad3af88d-0a4a-3159-9b76-6a6231aab924,cbaf510f-70fa-3120-947c-a97257c68495,divorce woman,http://www.podtrac.com/pts/redirect.mp3/streaming.howstuffworks.com/smnty/2015-04-22-smnty-divorced-women.mp3?awCollectionId=1007&awEpisodeId=898119,http://podcasts.howstuffworks.com/hsw/podcasts/smnty/2015-04-22-smnty-divorced-women.mp3,society always little suspicious divorced woman gold dig threat pitiful jilted wife likely neither cristen caroline wade stereotype uncover reality life divorcee,society always little suspicious divorced woman gold dig threat pitiful jilted wife likely neither cristen caroline wade stereotype uncover reality life divorcee,,HowStuffWorks,http://www.podtrac.com/pts/redirect.mp3/streaming.howstuffworks.com/smnty/2015-04-22-smnty-divorced-women.mp3?awCollectionId=1007&awEpisodeId=898119,16676345,audio/mpeg,,0,2982,2015-04-22 11:16:59 UTC,divorce woman divorcee divorcee gold digger gold dig wife divorce marriage divorced woman stereotype divorcee stereotype divorce rate divorce gender remarriage divorce remarriage
746,7e55231d-4637-3b4e-85c0-b18943eda878,30f75959-012d-3080-8f0f-2cb77ba1aefa,national recording registry part,http://bfuqua.libsyn.com/national-recording-registry-part-2,95587dd60e0af19382cdf46a14aa9786,highlight national recording registry include black bottom stomp bei mir bist du schon new san antonio rise perpetual motion sweet lorraine performer include marian anderson jelly roll morton bob will zora neale,size highlight national recording registry include black bottom stomp bei mir bist du schon new san antonio rise perpetual motion sweet lorraine performer include marian anderson jelly roll mort,,,http://traffic.libsyn.com/bfuqua/National__Recording_Registry_2.mp3?dest-id=33022,29268739,audio/mpeg,,0,2439,2011-01-16 05:15:22 UTC,registry jazz recording record acoustic
747,05b1254c-10bb-39d2-a0fe-bf6e71db1413,b33099cd-cc39-31f6-8029-b2bfd5e4ea5f,hear hear,http://recordings.talkshoe.com/TC-17959/TS-793619.mp3,http://recordings.talkshoe.com/TC-17959/TS-793619.mp3,hear hear,hear faith come luke apostle say lord luke context luke whole chapter translation,hear faith come luke apostle say lord luke context luke whole chapter translation,Apostle Bryant,http://recordings.talkshoe.com/TC-17959/TS-793619.mp3,33573850,audio/mpeg,Religion & Spirituality,0,1314,2013-10-11 09:03:46 UTC,bible study christian teaching christianity
748,83de6e1c-3135-3b23-ba85-0907484765a6,aca18946-90f7-31f9-9d4e-5220d11be44a,ben sorensen real country,https://www.podomatic.com/podcasts/realcountry/episodes/2012-06-01T06_54_57-07_00,http://realcountry.podomatic.com/entry/2012-06-01T06_54_57-07_00,catherine britt can change thing steven jaymes can remember forget,img pic britt can change thing steven jaymes can remember forget happen two world collide accord,catherine britt can change thing steven jaymes can remember forget happen two world collide accord mcclymont yet busby marou still believe also tune dixi chick harmoney james olivia newton john new willie nelson dash snoop dogg ben sorensen real country week real country interactive comment view share rate subscribe call request line anytime connect real country ben sorensen official page live event booking advertising opportunity please email get ad podcast,,http://realcountry.podomatic.com/enclosure/2012-06-01T06_54_57-07_00.mp3,50634133,audio/mpeg,,0,3164,2012-06-01 13:54:57 UTC,catherine britt change thing steven jayme remember that happen two world collide accord mcclymont busby marou still believe tune dixi chick harmoney james olivia newton j
749,ac32b83a-50c9-34d0-90f5-3f65d3867076,8845dc8b-cf65-36e0-8608-b6f9617de5ee,ready jump,http://dannyavila.podtree.com/2015/10/140-ready-to-jump/,http://dannyavila.podtree.com/?p=236,episode danny avila present ready jump,danny avila present ready jump spanish wonderboy danny avila crawl scene give look track hot,,Danny Avila,http://media.rawvoice.com/dannyavila/media2-dannyavila.podtree.com/media/podcast/Danny_Avila_-_Ready_To_Jump_140.m4a,146317596,audio/x-m4a,,0,140,2015-10-11 22:19:13 UTC,
750,2463ba86-12df-3609-acbd-b339533e2a2d,707c57c5-898c-3a7e-825e-93aa335b29cd,dance sense dance sense present lucky charme,https://www.podomatic.com/podcasts/dancesense/episodes/2013-01-16T07_04_23-08_00,http://dancesense.podomatic.com/entry/2013-01-16T07_04_23-08_00,lucky sound strong mix funky house groove sexy latin uplift tech house sound,img ts ba pic sound strong mix funky house groove sexy latin uplift tech house sound massive beat eclectic vibe tough african dru,lucky sound strong mix funky house groove sexy latin uplift tech house sound massive beat eclectic vibe tough african drum music dj set show strong resemblance fill diversity highly dynamic always tempo meet lucky charme bear june werner charm initially start hip hop dj lucky career club dj rapidly blow gradually find way house club scene obtain chance play string renowned dutch club dj set well know venue rotterdam jimmy woo amsterdam sand amsterdam escape amsterdam lucky grow reputation stop consequence lucky ask compile mix compilation supa fly house music release mark first dj mix cd follow year within month transform fanatic hobbyist respected club dj host night zu hause famous jimmy woo club amsterdam bring culture art music together pack room nowadays lucky perform energetic dj set big event festival emporium festival pleasure island sexy mother fucker samsobeat sneakerz latin village many high profile event producer lucky also know stand ground getcha damn hand sneakerz muzik co produce tony verdult reach dance tune top chart beatport chart receive tremendous support dj bob sinclar erick e fedde le grand roger sanchez follow release high plain dot collaboration tony verdult release sidney samson imprint samsobeat also skyrocket chart count frequent play like axwell sidney samson gregor salto lucky fine craftsmanship studio pass unnoticed global music scene soon result number high end remix job renowned artist like robin john dahlbäck annagrace sherry flavour dj jean rashid natural bear groove groovenatic hitmeister amongst other experience taste lucky expertise exclusively sign selekte music netherlands lucky showcase diversity label impressive résumé tune morninglight rastafari dance invasion elastik fine hour yet come find comfort progressive bigroom zone lucky charme make serious wave global music industry heavy recording contract single album around world universal record uk back pocket lucky unleash ton dance floor massacre come month feature world big vocalist topliner singer songwriter lucky charme,,http://dancesense.podomatic.com/enclosure/2013-01-16T07_04_23-08_00.mp3,143111368,audio/mpeg,,0,3577,2013-01-16 15:04:23 UTC,dance sense podcast lucky charm
751,7e8c2880-bcc3-3dc2-9533-cac25ea33486,c346feb3-f883-36b0-9e46-a476c351723c,spiral upward,http://feedproxy.google.com/~r/33voices-podcasts/~3/GmoZuhpEoeQ/spiraling-upward,http://www.33voices.com/interviews/spiraling-upward?media=5564b42137383000110b0000,podcast smart conversation business life,wendy wallbridge join discuss co creative power woman rise img gmozuhpeoeq,wendy wallbridge join discuss co creative power woman rise,meetu@33voices.com (33Voices),http://feedproxy.google.com/~r/33voices-podcasts/~5/WHwB4MzP23g/audio-a2d7c4a9575f70773f22222090a812a9.mp3,32604078,audio/mp3,,0,2038,2015-05-27 00:00:00 UTC,business entrepreneur thought leader author book inspiration
752,45bbb6b4-01e0-34c3-bbe1-b83e98fb7547,2006216c-9378-30a6-be2c-fa35140b8aaa,gsn podcast grouchy old geek episode,http://geeksyndicate.libsyn.com/gsn-podcast-grouchy-old-geeks-episode-3,a62bf39fdbb43b9b541aa9728eb872a0,welcome grouchy old geek monthly podcast discuss everything anything geek news statler waldorf british podcast host previously gog call comic book outsider podcast year,p welcome grouchy old geek monthly podcast discuss everything anything geek news statler waldorf british podcast host previously gog call comic book outsider podcast year decid,,,http://traffic.libsyn.com/geeksyndicate/Grouchy_Old_Geeks_Ep03.mp3?dest-id=15372,57883562,audio/mpeg,,1,138,2016-06-21 13:46:36 UTC,
753,b0fddff4-0bd6-3747-a73b-48dfb300234e,e9e6eee4-4eb8-3e48-b188-fea6cda5bef3,list business flippa,http://blog.virtualvalley.io/how-to-list-a-business-on-flippa/,http://blog.virtualvalley.io/?p=1601,episode million learn virtual valley list flippa write flippa list convert,episode million br virtual valley list write flippa list convert,episode million learn br br virtual valley list flippa br write flippa list convert br br virtualvalley io valley flippa,"Tom Hunt: Founder Of Startup Virtual Valley, TEDx Speaker, Dragon’s Den Failure & Internet Marketer/Entrepreneur.",http://media.blubrry.com/0_4_million_a_startups/traffic.libsyn.com/virtualvalley/Ep_127_edited.mp3,12475480,audio/mpeg,0-$4 Million Podcast,0,714,2016-07-05 11:00:56 UTC,
754,3bef71ac-71a1-3ae7-b552-c4c9fb210cd4,b079b935-e445-35df-a5bc-9f54ff079413,etmf podcast hitbox official interview,http://etmfpodcast.libsyn.com/etmf-podcast-hitbox-official-0,da9fae1cda26d00fcbee3e439cd6275e,marjie sit sarah adam kieren strange chi fi discuss life music cosplay follow hitbox official twitter sarah keiren follow together,p marjie sit sarah adam kieren strange chi fi discuss life music cosplay p follow hitbox official twitter sarah sarahadamsmusic ke,,,http://traffic.libsyn.com/etmfpodcast/Hitbox_Interview.mp3?dest-id=141055,19586068,audio/mpeg,,1,1225,2014-05-07 15:11:38 UTC,
755,66d89bbf-a842-3ea7-ab39-93519a792277,6ac3773b-1c9f-386d-96e4-8124613817b2,june good bbq central show,http://thebbqcentralshow.com/june-26-2016-best-of-bbq-central-show/,http://thebbqcentralshow.com/?p=2314,show tonight tonight good bbq central show air outdoor cooking channel spend past week try cram really good previous interview enjoyment,show tonight tonight good bbq central show air outdoor cooking channel spend past week try cram really good previous interview enjoyment chris lilly talk memphis,show tonight bbq central show air outdoor cooking channel spend past week try cram really good previous interview enjoyment chris lilly talk memphis may gc ronnie lottz get back mix review dive meter platform ray lampe go competition whole lot please make sure stop show sponsor check offer good way support show support see back live next tuesday shop icp help show shop icp icp show get small purchase invest back production make purchase cost help show thank also subscribe show icp bbq central radio icp play never miss segment interview show ever please review show use tune prefer different podcast catcher use show rss get full archive suggest use icp whatever like fine plug rss grab show host new podcast pitclub amazing weekly cover industry news week review competition score get industry interview icp pit less per stream show anywhere tune radio app available smart phone device visit icp tune website info instal phone search save easy contact call br email br icp skype br please support show sponsor br icp bbq icp poppa,Greg Rempe,http://media.blubrry.com/bbqcentral/p/www.thebbqcentralshow.com/bbqcs/july262016.mp3,87568927,audio/mpeg,best of show,0,337,2016-07-27 16:00:48 UTC,
756,8d433600-9a14-364c-bb13-6d8813156ffa,16f0a196-2fe2-3a8f-b1b9-b6d7a62856c9,revision statische seitengeneratoren metalsmith und css funktionssyntax,,http://workingdraft.de/?p=3166,rodney anselm schepp und stefan nehmen aktuelle entwicklungen css standard sowie statische seitengeneratoren für großprojekte angriff schaunotizen statische seitengeneratoren für großprojete und metalsmith stefan hat das letzte,rodney anselm schepp und stefan nehmen aktuelle entwicklungen css standard sowie statische seitengeneratoren für großprojekte angriff schaunotizen statische seitengeneratoren für großprojete und metalsmith stefan hat das letzte jahr da,rodney anselm schepp und stefan nehmen aktuelle entwicklungen css standard sowie statische seitengeneratoren für großprojekte angriff schaunotizen statische seitengeneratoren für großprojete und metalsmith stefan hat das letzte jahr damit verbracht html seiten einen statischen buildprozess zu bringen und spricht von seinen erfahrungen wie rodney ist er schnell zum schluß gekomman dass tool wie metalsmith dank ihrer feinen plugin architektur besten für die vielreichenden ansprüche unserer webseiten taugen rodney baut die dokumentation damit und nutzt dinge wie cheerio und ein selbstgeschriebens plugin um markup nach dem parsen zu verändern stefan erzählt von den bemühungen die stack für den gewöhnlichen content autor angenehm wie möglich zu machen und zeigt tool wie den liquid linter css function syntax weil man die color funktion mit bestehenden mitteln nicht problemlos definieren kann schraubt man einer neuen css funktionssyntax die sich mehr den property orientiert damit verbunden ist ein refactoring sämtlicher existierenden css funktionen auch jenen die schon seit ie zeiten einsatz sind sehr kontrovers aber doch durchdacht wir geben unseren senf dazu und überlegen ob man das auch ander hätte lösen können keine schaunotizen use argument parameter ecmascript umfangreiche erklärung zu allen anwendungsarten von argumenten und parametern history url geschichtlicher exkur zum fundament des web samt fortsetzung,"Peter Kröner, Hans Christian Reinl, Rodney Rehm, Stefan Baumgartner und Christian Schaefer",http://workingdraft.de/podpress_trac/feed/3166/0/wd-272.mp3,33662112,audio/mpeg,Uncategorized,0,2803,2016-08-20 15:56:34 UTC,uncategorize
757,7f26bd28-620e-3158-84ca-0df470e2c9e2,9c06fc6d-8536-3d22-9cec-79c4f03d08f3,az essential,http://deejaymikerizzy.podbean.com/e/az-essentials/,http://deejaymikerizzy.podbean.com/e/az-essentials/,always big az fan world still hang onto possibility nas az collaboration album classic brooklyn,mf web big az fan world still hang onto possibility nas az collaboration al,br always big az fan world still hang onto possibility nas az collaboration album classic brooklyn legend help build anticipation make mix could help realize day handful artist hip hop today even level witness greatness enjoy,Mike Rizzy,http://deejaymikerizzy.podbean.com/mf/feed/h2sqvt/AZ_Essentials.mp3,31956440,audio/mpeg,Uncategorized,1,1996,2012-08-28 16:47:38 UTC,
758,6f14f4ba-62a5-3e59-82f7-a1b1cfe1dc05,9a97c1be-ed09-3120-b0b3-1f87dd0c0d19,dvd verdict sound sight cinema good part,http://dvdverdictpresents.com/dvd-verdict-1464-sounds-and-sights-of-cinema-best-of-2013-part-4,cfbb2224c52f433ebef35ffff36a618d,week clark conclude countdown good film music,p week clark conclude countdown good film music offer selection john williams abel korzeniowski randy newman steven price joe hisaishi come top tune find,,,http://traffic.libsyn.com/dvdverdict/1464.mp3?dest-id=12672,58817346,audio/mpeg,,0,163,2014-02-28 01:39:06 UTC,podcast soundtrack dvdverdict filmmusic soundsandsight filmscore michaelstailey clarkdouglas
759,f7200178-b2a1-3aa2-bc36-a77819b41585,6f3fd47a-a300-304b-8a28-556ef9acba0f,preserve sanctity marriage fr tran,http://catholichomily.org/?p=791,http://catholichomily.org/?p=791,sunday june reading gospel,sunday june reading gospel,sunday june reading gospel,Father Jack Durkin and Guest,http://catholichomily.org/media/6-3-12PreservingTheSanctityOfMarriageFrTran.mp3,1,audio/mpeg,Father Augustine Tran,0,61,2012-08-05 22:07:18 UTC,father augustine tran
760,875cb2a8-027f-31ce-9968-c3e6c860c4ab,2c1ceeca-fc67-3464-ae1b-ff002b1c3a5d,gia sole del gange soprano note,http://thechoirlobby.com/gia-sole-del-gange-soprano-notes,f4d168916430f04c356f50a06ca99b66,,,,,http://traffic.libsyn.com/croding/Gia_Sole_Del_Gange.m4a?dest-id=27666,1143438,audio/x-m4a,,0,140,2012-09-08 14:12:48 UTC,
761,9bb516ec-693b-31e5-bdbf-e0f55b344152,a498936d-5e7d-3f8c-8ab6-8783c3a2acef,white light dj apt one,http://www.whitelightmixes.com/mixes/white-light-95-dj-apt-one,http://www.whitelightmixes.com/White%20Light%2095%20-%20DJ%20Apt%20One.mp3,dj apt one usa,white light dj apt one mix meditation season emotion evoke earth orbit physical principle conservation energy philosophically disconnect idea life linearity white light,white light dj apt one mix meditation season emotion evoke earth orbit physical principle conservation energy philosophically disconnect idea life linearity white light mix rcmp explore cold conflict technological human cosmo want bring thing back earth musically detail immediate tangible dark rosy well organic mix also contain debut track michael lion new alia mine program five movement movement snow reflection excerpt year wilderness cocteau twins thin air three degree collage movement spring storm yellow sunshine along seashore curtis mayfield staple singer sex kan sano everybody love sunshine burnso bad news star serge gainsbourg bad news star movement dog day introspection dj apt one shadoe willing interlude gil scott heron brian jackson willing dennis parker like eagle herb alpert rotation movement autumn mercurial chris rea josephine chris coco edit elyas khan bell instrumental robert lux todd edwards still get sunshine michael lion remix kon gang sunlight movement earth cycle earth wind fire kalimba tree terje edit lamont dozier go back root info dj apt one please visit download mix read contribute artist always remember look light,The White Light Mixes,http://www.whitelightmixes.com/White%20Light%2095%20-%20DJ%20Apt%20One.mp3,150514429,audio/mpeg,Music,0,276,2014-02-17 11:35:55 UTC,white light dj disco mix mixtape cosmic space music neoteric dj neoteric matty c fred falke classixx alan braxe lifelike daft punk house deep house aeroplane nu disco nu disco white light mix modular cut copy kris menace twelve kitsune
762,880797ce-9f00-326c-941f-eff3ec6400e0,3b2ee0b1-5118-3dc9-8eaa-93312a27d37e,dr ward dean life extension brain maximization,http://smartdrugsmarts.com/dr-ward-dean-life-extension/,http://smartdrugs.wpengine.com//?p=65,dr dean explain groundbreaking book evolve technical manual patient widely know book improve brain activity smart drug really focus improve cognitive ability normal people,p dr dean explain groundbreaking book evolve technical manual patient widely know book improve brain activity smart drug really focus improve cognitive ability normal people,,"Jesse Lawler: Brain Enthusiast, Biohacker, Nootropics Nerd, Multichannel Eccentric",http://media.blubrry.com/smartdrugsmarts/content.blubrry.com/smartdrugsmarts/SDS001.mp3,46938114,audio/mpeg,,0,1947,2012-11-29 06:46:56 UTC,
763,866eb046-9c80-39ee-a23d-403d6f08a228,2d31d77b-cc39-3e91-b7f4-d657894c3540,waldkurort zum relaxen,http://cdn-storage.br.de/MUJIuUOVBwQIbtC2uKJDM6OhuLnC_2rc571S/_-dS/9AxH_-ky/160826_1730_Abendschau_Waldkurort-zum-Relaxen.mp4,160826_1730_Abendschau_Waldkurort-zum-Relaxen.mp4,,zur natur finden weg von der zivilisation und entspannen das geht nicht hier das geht nur weit weg weit gefehlt um richtig abzuschalten und um zu sich selbst zu finden dafür braucht es keine weltreise das geht auch niederbayern,zur natur finden weg von der zivilisation und entspannen das geht nicht hier das geht nur weit weg weit gefehlt um richtig abzuschalten und um zu sich selbst zu finden dafür braucht es keine weltreise das geht auch niederbayern,BR Fernsehen,http://cdn-storage.br.de/MUJIuUOVBwQIbtC2uKJDM6OhuLnC_2rc571S/_-dS/9AxH_-ky/160826_1730_Abendschau_Waldkurort-zum-Relaxen.mp4,9013540,video/mp4,,0,125,2016-08-26 17:30:01 UTC,abendschau freizeit natur podcast bayerischer rundfunk br fernsehen
764,168ae5b2-6e4e-3b2b-8d62-948c626abb90,89011f5c-9103-3376-9ec8-7c1c560e7a6a,episode full shit,http://tyrantsdue.com/2014/05/episode-47-is-full-of-shit/,http://tyrantsdue.com/?p=242,show contain stuff trololoololololol look horus heresy book iii,show contain stuff trololoololololol look horus heresy book iii,show contain stuff trololoololololol look horus heresy book iii,Tyrant's Due,http://tyrantsdue.com/podcast/tyrantsdue47.mp3,119642531,audio/mpeg,Podcast,1,517,2014-05-14 22:13:06 UTC,podcast
765,5c1c20e2-d4a2-3a81-8fe0-f4c93b3b6d35,4e16b56b-b550-39d6-a047-6883e87f6d57,nerdcast guerra das malv falkland,https://jovemnerd.com.br/nerdcast/nerdcast-303-a-guerra-das-malv-falklands/,https://jovemnerd.com.br/nerdcast/nerdcast-303-a-guerra-das-malv-falklands/,,lambda lambda lambda hoje alottoni bluehand jp eduardo spohr tucano e azaghal contam como argentina e reino unido entraram em guerra há anos pela ilhas malvinas ou serão falkland neste podcast aprenda blefar com uma junta militar saiba de,lambda lambda lambda hoje alottoni bluehand jp eduardo spohr tucano e azaghal contam como argentina e reino unido entraram em guerra há anos pela ilhas malvinas ou serão falkland neste podcast aprenda blefar com uma junta militar saiba de onde fausto fawcett tirou calcinha exocet entenda importância de navio invisívei e veja,,https://nerdcast.jovemnerd.com.br/nerdcast_303_guerra_das_malvinas.mp3,4717,audio/mpeg,,0,1237,2012-03-23 09:20:10 UTC,
766,eea12d38-0a3b-306b-a74c-30b178eb9bbb,f59a1cbd-1f05-3eef-b343-9bc4f72a6bf4,abduction evidence hybridization transgender exps,http://www.atlanticcoastufos.com/comments.html,F5D4CCAA-E9B5-4483-86E4-351C6C80AF86-848-000006DCCFA12AB9-FFA,abduction evidence hybridization transgender exps,kate guest carol rainey tyler kokjohn ms rainey co author sight unseen budd hopkin short alien human hybridization falsifiable concept science tool test whether theory real,kate guest carol rainey tyler kokjohn ms rainey co author sight unseen budd hopkin short alien human hybridization falsifiable concept science tool test whether theory real also like discuss constitute evidence tyler kokjohn specialist bacteriophage biology special emphasis identification characterization bacteriophage lytic human bacterial pathogen pseudomonas member american society microbiology american association advancement science society kokjohn also member world future society frequent speaker world future society conference,Atlantic Coast Ufo Conferences LLC,http://www.atlanticcoastufos.com/podcasts/10-29-10.mp3,21721384,audio/mpeg,,0,3103,2010-10-29 16:54:49 UTC,abduction evidence hybridization transgender experiemnt carol rainey tyler kokjohn
767,0dd3a591-e6f6-3f9a-86e8-b12881385c9a,7261af16-dfe8-3e6c-9116-f6e01b32ee98,remember force awaken yet,http://www.simplysyndicated.com/remember-when-the-force-hadnt-awakened-yet/,http://www.simplysyndicated.com/remember-when-the-force-hadnt-awakened-yet/,record force awaken release enjoy easy question think hard remember murky pre dawn history especially time new star war flick know star war trivia,p record force awaken release enjoy easy question think hard remember murky pre dawn history especially time new star war flick know star war trivium,record force awaken release enjoy easy question think hard remember murky pre dawn history especially time new star war flick know star war trivium,Simply Syndicated,http://feeds.soundcloud.com/stream/240063986-atw9k-remember-when-the-force-hadnt-awakened-yet.mp3,55047583,audio/mpeg,Atomic Trivia War 9000,0,3376,2016-01-02 11:59:53 UTC,
768,cd9b156c-1b7d-39eb-bf86-c29c8e542ba6,8c7e171a-6ac3-32eb-96b6-72c50316ad22,old familiar song,http://www.morningsidepc.org/sermons,http://morningsidepc.com/podcast/AnOldFamilarSong.mp3,,sermon rev dr baron mullis scripture luke micah,,,http://morningsidepc.com/podcast/AnOldFamilarSong.mp3,12000000,audio/mpeg,,0,1077,2015-12-20 23:00:00 UTC,
769,3148ceb7-2e40-3335-873a-514995354db9,28a6b228-67ad-3d81-815a-ede24cea1c91,episode,http://www.bbc.co.uk/programmes/b06yjdp2,urn:bbc:podcast:b06yjdp2,kathryn tickell introduce work soler barber ive halvorsen grainger skempton,part radio folk connection weekend northumbrian piper fiddler kathryn tickell choose favourite classical piece inspire folk music include work antonio soler samuel barber charles ive johan halvorsen percy grai,part radio folk connection weekend northumbrian piper fiddler kathryn tickell choose favourite classical piece inspire folk music include work antonio soler samuel barber charles ive johan halvorsen percy grainger juan de araujo henry cowell pehr henrik nordgren howard skempton,BBC Radio 3,http://open.live.bbc.co.uk/mediaselector/5/redir/version/2.0/mediaset/audio-nondrm-download/proto/http/vpid/p03qfp4r.mp3,25760000,audio/mpeg,,0,1610,2016-01-30 00:00:00 UTC,
770,e2560080-79f7-3644-bb78-293039e78d06,98f0f00a-450b-3c6c-80ba-b6258c6972b6,hugo martínez ministro de relaciones exteriore,http://www.penchoyaida.com/audios/programas/Pencho_y_Aida_-_HugoMartinez_CancillerDeLaRepublica_120916.mp3,D21853F9-D37C-441A-8DE9-E826919DDA23,conversamos con el canciller hugo martínez ministro de relaciones exteriore sobre temas de migración tps asilo político los acuerdos de los paíse del triangulo del norte las nuevas embajadas en sur américa,conversamos con el canciller hugo martínez ministro de relaciones exteriore sobre temas de migración tps asilo político los acuerdos de los paíse del triangulo del norte las nuevas embajadas en sur américa,conversamos con el canciller hugo martínez ministro de relaciones exteriore sobre temas de migración tps asilo político los acuerdos de los paíse del triangulo del norte las nuevas embajadas en sur américa,Pencho y Aída,http://www.penchoyaida.com/audios/programas/Pencho_y_Aida_-_HugoMartinez_CancillerDeLaRepublica_120916.mp3,27701114,audio/mpeg,,0,3443,2016-09-12 11:39:52 UTC,pencho aida el salvador hugo martinez relacione exteriore cancilleria tps asilo politico
