,id,show_id,title,link,guid,subtitle,description,summary,author,audio_url,audio_file_size,audio_mime_type,category,explicit,length,pub_date,keywords
0,01154863-5892-3bdb-bd55-969689561906,580ca3d7-1d85-3ef3-a1b4-c6f4edf9ff65,journey george clooney find janeway,http://trek.fm/to-the-journey/138,4ff44f9bc4aa4a0dd8ca3ab3:50cd794ae4b08d91f1b65135:560c73f5e4b093206c06ca9e,top five character moment small gripe glaring error char tristan run top five character moment voyager episode journey,top five character whether due temporal rift alien virus one common way star trek audience know something right make character say something normal,top five character moment whether due temporal rift alien virus one common way star trek audience know something right make character say something normally would hero sift clue help determine go make thing right usually time character moment intentional make screen nevertheless sometimes small glitch new writer director fully know character time glaring mistake stem sloppy inconsistent writing whatever reason frustrating viewer episode journey char tristan break top five character moment voyager microwormhole sized gripe macroviral error host tristan riddell charlynn schmiedt editor tristan riddell producer charlynn schmiedt executive producer charlynn schmiedt norman lao matthew rushing bryan jones associate producer kenneth trip jamie duce aaron harvey production manager richard marquez content manager nguyen send we feedback twitter facebook voicemail contact form visit website subscribe itune support network become patron patreon help we keep star trek talk come every week great perk,Trek.fm,http://traffic.libsyn.com/tothejourney/ttj-138.mp3,32657154,audio/mpeg,Voyager,0,2651,2015-09-30 23:44:45 UTC,podcast journey voyager list character moment janeway equinox kes fury
1,26087c95-f627-30d7-aa8a-9d72daa6d26c,71619835-0783-3d3f-bc4c-850031dd5af8,world game podcast december,http://feedproxy.google.com/~r/twgpodcast/~3/i_Yj6teAGWk/the-world-game-podcast-4,"tag:soundcloud,2010:tracks/69909432",world game podcast week look,world game podcast week look mariner down red broich get send shed costa problem,world game podcast week look mariner down red broich get send shed costa problem feds,SBS The World Game,http://feedproxy.google.com/~r/twgpodcast/~5/kWtkNwDVMl8/69909432-sbstheworldgame-the-world-game-podcast-4.mp3,14386269,audio/mpeg,,0,1798,2012-12-04 06:11:33 UTC,sbs twg world game soccer football shootout stoppage time italian game ball les murray craig foster jesse fink david basheer scott mcintyre vitor sobral mariana rudan stuart randall philip micallef tim vickery
2,6d713bbd-4d96-3ac3-8164-563926963832,9a3d6c76-052e-3f95-9f8b-b0b21b983a02,drunk dripping drunk,http://shaneandtom.libsyn.com/drunk_dripping_drunk_71_,http://shaneandtom.libsyn.com/index.php?post_id=206603#,even ask listen enjoy whatever,even ask listen enjoy,,,http://traffic.libsyn.com/shaneandtom/drunk_dripping_drunk.mp3?dest-id=26206,19594870,audio/mpeg,,0,2449,2007-04-23 01:59:00 UTC,
3,c0e753ea-28c3-3550-9bc5-519b71c7e462,023e6901-ff34-329d-8954-95ba55ed1c8d,return ancient ritual part five ritual place people white house,https://www.podomatic.com/podcasts/preemptionbroadcast/episodes/2011-09-09T16_29_57-07_00,http://preemptionbroadcast.podomatic.com/entry/2011-09-09T16_29_57-07_00,moment skip beginning not know,moment skip beginning not know ok,moment skip beginning not know ok,,http://preemptionbroadcast.podOmatic.com/enclosure/2011-09-09T16_29_57-07_00.mp3,56549074,audio/mpeg,,0,3534,2011-09-09 23:29:57 UTC,voodoo white house shatter darkness dizdar
4,48d8cbb2-ce14-32a2-b82d-b71891f4eaf4,ef42fe17-8acb-3671-8234-1327242f1cfc,mac os ken,http://macosken.libsyn.com/mac-os-ken-08-22-2012,83e3c3caccce9c244cf99a06e85901eb,apple samsung make closing argument case go jury samsung invest billion upgrade austin tx plant make chip smartphone include iphone techcrunch secret source say verizon block staff vacation,apple samsung make closing argument case go jury samsung invest billion upgrade austin tx plant make chip smartphone include iphone techcrunch secret source say verizon block staff vacation septembe,,,http://traffic.libsyn.com/macosken/macosken120822.mp3?dest-id=11799,8372262,audio/mpeg,,0,823,2012-08-22 08:41:57 UTC,
5,a2039432-1db2-34b3-a763-bc67677b67e0,fec24cd6-3682-3429-aa5d-905324f4333f,club hit mix vol,https://www.podomatic.com/podcasts/manilaclubbing/episodes/2014-11-30T23_16_07-08_00,http://manilaclubbing.podomatic.com/entry/2014-11-30T23_16_07-08_00,mix erik gulo playlist one direction steal girl daloop remix jeremih,img ts ce remixcast pic erik gulo playlist one direction steal girl daloop remix jeremih feat yg tell zoo station club mix,mix erik gulo playlist one direction steal girl daloop remix jeremih feat yg tell zoo station club mix michael jackson love never feel good david morale eric kupper frankie knuckle classic tribute remix far east movement ft ryan tedder rocketeer remix betty somebody love starsmith extended remix tinashe ft rocky pretend dave aude remix waze odyssey vs kelly bump n grind oliver x tchami myb nick bike shorty edit rixton wait calvo remix paramore be fun smash mode extend jason derulo girl remix beyonce good thing never funk generation club mix empire sun dna calvin harris extend remix oliver trak zamboni nick bike shorty edit katy perry x jean walk air nick bike shorty edit,,http://manilaclubbing.podomatic.com/enclosure/2014-11-30T23_16_07-08_00.mp3,57317099,audio/mpeg,,1,3591,2014-12-01 07:16:07 UTC,club hit mix dj electronica house
6,c5501fb5-87d5-3f2e-8bdb-a1d87929b0af,4cf6d50e-4c9e-31ba-8f66-5198f28f8447,mayacast episode part faction profile part,http://mayacast.libsyn.com/mayacast-episode-81-hsn3-part-4-faction-profiles-part-2,418739e6472bf0c062b2a8457309a4e2,episode mayacast tom kip discuss profile nomad combine army aleph tohaa mercs talk change make new role new troop play announce,p episode mayacast tom kip discuss profile nomad combine army aleph tohaa mercs talk change make new role new troop play announce lucky winner,,,http://traffic.libsyn.com/mayacast/MayaCast_Episode_81.mp3?dest-id=194303,133515392,audio/mpeg,,0,3173,2016-05-06 18:30:00 UTC,
7,de0256da-e36a-3790-8b1b-c0043cc0eed6,354896e6-64bd-39e8-8828-54393f225dd9,강미은 숙명여대 미디어학부 교수 재치코드 당신을 기억하게 만드는 힘,,http://provider.cbspodcast.com/cgi-bin/podcast.fcgi/cbsvod/fifteen_minutes/20131014_315_KangMiEun.mp4,,,이 시대에는 재치 중요합니다 재치와 위트가 있다는 것은 모든 능력에 플러스 작용합니다 기본 능력에다가 재치코드가 있으면 더 빛날 수 있다는 이야기입니다 재치코드의 많은 사례를 통해 그 중요성을 짚어보려 합니다 또한 재치코드를 키울 수 있는쉽고 효과적인 방법도 알려드리겠습니다,CBS,http://provider.cbspodcast.com/cgi-bin/podcast.fcgi/cbsvod/fifteen_minutes/20131014_315_KangMiEun.mp4,114720768,video/mpeg,,0,952,2013-10-14 15:00:00 UTC,
8,958d7f7e-e11b-3711-a7a5-b44bad1f3ab0,2dcb665b-252f-3d6f-b60d-ec533582faf8,fracke ray tense hour,,http://media.ccomrcdn.com/media/station_content/1209/2016/11/mp3/default/america_s_trucking_network_12a_0_1479353307.mp3,trucking radio,caller hour talk fracke low oil oil reserve end hour ray tensing trial bring,caller hour talk fracke low oil oil reserve end hour ray tensing trial bring,Mid-5am,http://media.ccomrcdn.com/media/station_content/1209/2016/11/mp3/default/america_s_trucking_network_12a_0_1479353307.mp3?CPROG=PCAST&MARKET=CINCINNATI-OH&NG_FORMAT=&SITE_ID=1209&STATION_ID=WLW-AM&PCAST_AUTHOR=Mid-5am&PCAST_CAT=&PCAST_TITLE=America's_Truck,0,audio/mpeg,,0,2400,2016-11-17 02:21:12 UTC,
9,d5e1f937-8f28-3e12-9e90-915e65714ac4,94d83296-729d-30ad-aedc-d11ae0ace9a8,auto harp,,http://media.ccomrcdn.com/media/station_content/2039/2016/10/mp3/default/pp-friday-101416_0_1476472053.mp3,philip phile weekday,philip phile weekday,philip phile weekday,Philips_Phile,http://media.ccomrcdn.com/media/station_content/2039/2016/10/mp3/default/pp-friday-101416_0_1476472053.mp3?CPROG=PCAST&MARKET=ORLANDO-FL&NG_FORMAT=&SITE_ID=2039&STATION_ID=WTKS-FM&PCAST_AUTHOR=Philips_Phile&PCAST_CAT=&PCAST_TITLE=The_Philips_Phile,0,audio/mpeg,,0,600,2016-10-14 19:04:21 UTC,
10,6f525b7e-857a-3a29-85a5-9bee53a70075,fee68085-d9f1-3f1c-a8e6-5490f35e3434,tsn toronto leafs lunch mike hogan jamie mclennan hour march,,http://iphone.tsn.ca/tsnpodcasts/LL_H1March19.mp3,tsn toronto leafs lunch mike hogan jamie mclennan hour march,,mike hogan jamie mclennan talk corey perry contract extension anaheim chat lance pugmire la time,TSN.ca,http://iphone.tsn.ca/tsnpodcasts/LL_H1March19.mp3,4989537,audio/x-mpg,,0,2646,2013-03-19 14:14:41 UTC,tsn toronto leafs lunch mike hogan jamie mclennan
11,8e853999-b3cd-33d8-be7c-91b520040b5f,847d8240-19a0-3960-943d-6dc76c24e603,weekly roundup indie publishing news stuff april,http://selfpublishingroundtable.com/weekly-roundup-of-indie-publishing-news-and-stuff-3-april-2016/,http://selfpublishingroundtable.com/?p=3237,science fiction author jamie dodge join erica today discuss topic author tear plagiarist shreds original content creator feel sorry plagiarist james patterson present,science fiction author jamie dodge join erica today discuss topic author tear plagiarist shred original content creator feel sorry plagiarist james patterson present today ai write novel,,Self Publishing Round Table,http://traffic.libsyn.com/selfpublishingroundtable/RT-Blab-011.mp3,17004169,audio/mpeg,,1,2125,2016-04-04 15:00:43 UTC,
12,1a5d4dcc-9345-32fa-8d52-4791cb3dba2e,e762b328-af69-3e81-a12b-1ae9de162c9b,la grande finale,http://geniforklarat.libsyn.com/75-la-grande-finale,c405e589e65806abbab083513b9abeb7,här får du höra några av vår tids största tänkare tankar om vetenskap och samhället stort ingen fråga är för stor eller svår för att avhandlas programmet programledare,font size line height font family får du höra några av vår tids största tänkare tankar om vetenskap och samhället stort ingen fråga är för stor eller svår för att avhandlas programmet pro,,,http://traffic.libsyn.com/geniforklarat/Geniforklarats04e22grandfinale.mp3?dest-id=96509,49697552,audio/mpeg,,0,3534,2015-06-11 23:14:36 UTC,
13,7c82152b-21cd-3edc-8f22-c7e133aaf2e8,06eff290-c5c5-3b01-b993-8b54ba042d74,episode croak,http://geeklyinc.com/drunks-and-dragons-episode-93-croaked/,http://geeklyinc.com/?p=24422,week spellbind episode zird give adventurer advice also deal harper wizard style embarrassing fortunately gang may close recover demonomicon cool rad,spellbinding episode zird give adventurer advice also deal harper wizard style embarrassing fortunately gang may close recover demonomicon cool,week spellbind episode zird give adventurer advice also deal harper wizard style embarrassing fortunately gang may close recover demonomicon cool rad subscribe itune subscribe via rss feedburner direct download,GeeklyInc,http://www.geeklyinc.com/dndpodcast/dnd_ep93.mp3,47315491,audio/mpeg,tabletop,1,438,2014-09-22 18:47:01 UTC,
14,e6620dcd-4908-3c28-be5b-822a4a52ee57,6af656ff-42a8-3c29-b9f7-3cbbefffe649,karel cast cenk young turk,,http://www.thekdw.com/podcasts/June2014/Seg3.mp3,get young turk we today,get young turk we today,,"KDW Productions, LLC",http://www.thekdw.com/podcasts/June2014/Seg3.mp3,13458703,audio/mpeg,Talk Radio,0,840,2014-06-19 11:16:59 UTC,karel radio kfi kgo krxa kgoe huffingonton post
15,63c55af8-e3f4-3652-a2e4-231318d898d0,4660efbc-d4eb-392f-97c1-70275296661f,episode scar tissue,http://www.filmgeekradio.com/2013/07/avenging-angels-5-scar-tissue/,http://www.filmgeekradio.com/2013/07/avenging-angels-5-scar-tissue/,one bad episode ever rachael dexter cast help andrew charlie figure,special guest rachael hughes dexter cast join andrew charlie discuss fourth episode final season scar tissue yate guy jamie suddenly sexually deviant go de,special guest rachael hughes dexter cast join andrew charlie discuss fourth episode final season scar tissue yate guy jamie suddenly sexually deviant go deb feel clunky could one bad episode entire series tune find show note intro feedback clip general thought quinn angie jamie urge yate brain surgeon masuka daughter deb epiphany end vogel plan callback early season ellway deb change perspective final scene reference friday show close forget contact show email thank listen,"Andrew Johnson, Charlie Nash",http://feedproxy.google.com/~r/fgr-avengingangels/~5/WYrfzPpYiZk/AA_005.mp3,77962025,audio/mpeg,TV & Film,1,1344,2013-07-25 20:51:46 UTC,film geek radio avenge angel dexter scar tissue showtime
16,d348c4e7-56ac-340d-97bb-b13c41daf227,31297ebd-8183-3e87-8ca0-e5077c2926d0,whiskycast episode may,http://whiskycast.libsyn.com/whisky-cast-episode-370-may-20-2012,5e2e5297e8448c91c9065145279e0997,iconic year scotland bowmore distillery though fact would know decade cask lay year produce legendary black bowmore along gold white bowmore make bowmore trilogy,iconic year scotland bowmore distillery though fact would know decade cask lay year produce legendary black bowmore along gold white bowmore make bowmore trilogy series,,,http://traffic.libsyn.com/clean/whiskycast/WhiskyCast_20120520.mp3?dest-id=35929,19983528,audio/mpeg,,0,2491,2012-05-20 05:34:28 UTC,kentucky bourbon irish scotch whiskey whisky ireland bowmore islay
17,8388626e-3833-314b-b76a-fdb2aa7e289c,a99da377-d86c-37a9-9121-cb30372cc763,market roundup market finish week strong gain,https://static1.1.sqspcdn.com/static/f/930133/26530913/1441994411303/091215-Market.mp3?token=BoimswyiVAxQ2iaj1XyDjyTNwQ8%3D,49530BEA-B533-46F3-B2E3-0019332D6F26,market roundup market finish week strong gain,holiday shorten week end three major index close tuesday stock rally big one day gain two week surge large percentage point gain since aug stock roar back sello,holiday shorten week end three major index close tuesday stock rally big one day gain two week surge large percentage point gain since aug stock roar back selloff cause unease slow growth china world second big economy tuesday gain knock back wednesday decline dow jones industrial average decline despite rise nearly point early day follow sharp gain asia europe china finance ministry signal fiscal stimulus way thursday action push nine ten sector positive territory utility lagging index close green zone friday technology healthcare lead day producer price index hold well expect august unchanged additionally university michigan consumer confidence index september lose point september reading well consensus estimate third consecutive monthly decline put low year meanwhile crude oil shed settle barrel,Henssler Financial,https://static1.1.sqspcdn.com/static/f/930133/26530913/1441994411303/091215-Market.mp3?token=BoimswyiVAxQ2iaj1XyDjyTNwQ8%3D,8867840,audio/mpeg,,0,883,2015-09-14 17:19:19 UTC,henssler matt hames troy harmon charlie holloway real estate ira tenant landlord investment self employment
18,11b5706e-ab56-381a-b92e-7dc0baf88906,5e7f4acf-36cc-3b89-99da-1078bd09b1fe,use analytic tackle tough agency challenge interview dean silverman former head irs office compliance analytic episode,http://govinnovator.com/dean_silverman/,http://govinnovator.com/?p=4551,use analytic tackle tough agency challenge interview dean silverman former head irs office compliance analytic,public agency federal state local level use analytic include test learn strategy tackle tough challenge get insight dean silverman founder former head irs office com,dean silverman former head irs office compliance analytic discuss public agency use analytic tackle key challenge,Andy Feldman,http://media.blubrry.com/govinnovator/govinnovator.com/wp-content/uploads/2015/03/Silverman.mp3,12004204,audio/mpeg,2015,0,750,2015-03-26 07:08:38 UTC,
19,c8f57938-9fea-3c79-9afa-fb0285a5e9bb,3cd6ede5-1b47-32ad-b156-18faad35dc99,aee host talk translate idiom english,http://allearsenglish.libsyn.com/aee-155-startupradiode-host-talks-about-how-not-to-translate-your-idioms-into-english,b46cf128eac5d8c84f0bc4f64e17a4f7,find translate idiom english,take free ielt video training course today talk joe menninger host p joe e,,,http://traffic.libsyn.com/allearsenglish/155_AEE_155__StartupRadio.de_Host_Talks_About_How_NOT_to_Translate_Your_Idioms_into_English.mp3?dest-id=161870,15360444,audio/mpeg,,0,904,2014-07-24 05:00:00 UTC,
20,d11ccbd0-755e-32ec-8777-ef16c09ce0a2,95842a13-0940-318f-8de6-d237528f1628,steven aldrich ceo posit science,http://weeklyleader.libsyn.com/51_steven_aldrich_ceo_posit_science,http://weeklyleader.libsyn.com/index.php?post_id=617403#,steven aldrich ceo posit science,p detailed shownote link go,,,http://traffic.libsyn.com/weeklyleader/Weekly_Leader_51_Steven_Aldrich_-_CEO_-_Posit_Science.mp3?dest-id=17002,55791506,audio/mpeg,,0,1169,2010-05-21 04:01:00 UTC,podcast science leadership steven aldrich posit
21,4e559fda-d4fa-35a9-831b-dd8051621c96,85694d41-674b-31dd-8c0a-d41f3c2d1947,pregnancy up down,http://feedproxy.google.com/~r/PregtasticPregnancyPodcast/~3/qefp_gz0vjE/preg_237_pregnancy_ups_and_downs.mp3,4c59baca73072a1796c10779a5480d5e,take maternity leave soon one panelist share expect boss spot bleeding send another mommy doctor everything turn ok handicap parking pregnant yes possible find,p take maternity leave soon one panelist share expect boss spot bleeding send another mommy doctor everything turn ok handicap parking pregnant yes possible find app,,,http://feedproxy.google.com/~r/PregtasticPregnancyPodcast/~5/2CMfRba-2_E/preg_237_pregnancy_ups_and_downs.mp3,11177389,audio/mpeg,,0,1863,2011-10-19 07:38:00 UTC,pregnancy maternity boss parking bleeding pregtastic skincare leave handicap belli
22,2bc73124-0059-375a-9401-e7356787be30,3816a210-ced4-3f24-b8a0-253372a12f9e,today top morning call,,http://www.ubspodcast.ch/us/wmr/podcast/en/topofthemorning/150605-TOTM_Call_Podcast.mp3,week review preview greece imf fed rise interest rate job number david lefkowitz senior equity strategist,week review preview greece imf fed rise interest rate job number david lefkowitz senior equity strategist,week review preview greece imf fed rise interest rate job number david lefkowitz senior equity strategist,Anthony Pastore,http://www.ubspodcast.ch/us/wmr/podcast/en/topofthemorning/150605-TOTM_Call_Podcast.mp3,11062442,audio/mpeg,,0,691,2015-06-05 15:02:00 UTC,investment research strategy analysis market market economic top morning macro ubs portfolio
23,c19799f0-465b-3b5d-a471-aab7004d6ea5,3f3a3288-6667-3a8b-89d9-5a0b0a2a44bc,crash course weekly world news,http://ccia.libsyn.com/crash-course-in-the-weekly-world-news,4191ee48a263d9d3fc78fcc86d1cc1a9,batboy become new host crash course awesome headline might read episode description feature cover weekly world news ricky bryan give rundown wonderfully fake weekly news,p batboy become new host crash course awesome headline might read episode description feature cover weekly world news ricky bryan give rundown wonderfully fake weekly news paper li,,,http://traffic.libsyn.com/ccia/CCIA_Ep_044_Weekly_World_News.mp3?dest-id=67902,23954393,audio/mpeg,,0,1498,2012-03-05 04:24:28 UTC,
24,0be4fe73-a166-3625-99df-c38c3c701d0f,804628b5-8789-3806-b83e-c2a280331434,mechanical man part two,http://recordings.talkshoe.com/TC-11773/TS-394217.mp3,http://recordings.talkshoe.com/TC-11773/TS-394217.mp3,mechanical man part two,yellow mask succeed destroy daily planet building,yellow mask succeed destroy daily planet building,Adam Graham,http://recordings.talkshoe.com/TC-11773/TS-394217.mp3,3096525,audio/mpeg,Arts & Entertainment,0,774,2010-09-05 23:50:00 UTC,superman old time radio superhero
25,27cf2e28-113b-3ca5-8f18-93b778288620,be16a874-75b1-376d-9cd2-fed428c83122,acceleration miracle,http://www.xpministries.com/2015-acceleration-of-miracles/,http://www.xpministries.com/?p=7191,would like tap supernatural healing watch patricia king evangelist rambo other learn acceleration miracle desire tap season accelerated miracle,p would like tap supernatural healing watch patricia king evangelist rambo other learn acceleration miracle desire tap season accelerated miracle portal open,would like tap supernatural healing watch patricia king evangelist rambo other learn acceleration miracle desire tap season accelerated miracle portal open miracle release,XPVIDEOS Podcasts | www.xpministries.com,https://xpmedia-node.s3.amazonaws.com/node/540/16540/default.mp4,35828393,video/mp4,XPVIDEOS Podcasts,0,375,2015-09-30 23:43:55 UTC,
26,347f2ac9-469c-3d37-95d9-287b608313e6,da1471a3-475f-3c08-8bb6-473bbbb673ad,funemployment radio episode,http://traffic.libsyn.com/funemploymentradio/FunemploymentRadioEpisode93.mp3,http://funemploymentradio.libsyn.com/index.php?post_id=596809#,weird al impending vacation airport security fear fly mexico census weird ball talk big baby hockey tebow good,p weird al impending vacation airport security fear fly mexico census weird ball talk big baby hockey tebow good chant ever entertainment news skeletor whore jesse james jersey shore trololo annoying,,,http://traffic.libsyn.com/clean/funemploymentradio/FunemploymentRadioEpisode93.mp3?dest-id=21933,43770358,audio/mpeg,,1,167,2010-03-24 20:50:00 UTC,podcast radio fun humor satire local sport x greg oregon portland dylan sarah tila unemployment skeletor nibler
27,302bfcb1-d360-354a-a37d-d975a2c4fb50,1d1f030d-9472-3004-8ee6-99fb9eb80bc7,john digweed make brazil new year eve,https://www.podomatic.com/podcasts/madeinbrazil/episodes/2010-12-20T18_03_18-08_00,http://madeinbrazil.podomatic.com/entry/2010-12-20T18_03_18-08_00,,img ts ce ad pic,,,http://madeinbrazil.podomatic.com/enclosure/2010-12-20T18_03_18-08_00.mp3,107407602,audio/mpeg,,0,6712,2010-12-21 02:03:18 UTC,john digweed podcast madeinbrazil listen house audio mpeg
28,4f390c2b-75a2-352c-862b-9ee4a94e2476,1a2768b0-2595-385d-8cf1-bd4669c4e107,scott volk henani,http://ccogmedia.org/130113-1030-scott-volk-henani-here-i-am,31c23e48d7a417bc1bdc368527c6b734,scott volk guest speaker morning january genesis exodus isaiah henani behold stop focus,scott volk guest speaker morning january genesis exodus isaiah br purpose br henani behold stop,,,http://traffic.libsyn.com/ccog/ScottVolk-130113-1030-Henani_HereIAm.mp3?dest-id=13015,50726194,audio/mpeg,,0,3171,2013-01-14 21:02:00 UTC,
29,587ce2d8-8596-3a2b-bade-02a392128ef2,3f8b3d8d-3704-394a-aacd-a7c51c01c250,여군의 적은 아군 남자,,http://provider.cbspodcast.com/cgi-bin/podcast.fcgi/cbsaod/newsshow_journal/20141015_newsshow_journal.mp3,,,,CBS,http://provider.cbspodcast.com/cgi-bin/podcast.fcgi/cbsaod/newsshow_journal/20141015_newsshow_journal.mp3,5521408,audio/mpeg,,0,345,2014-10-15 20:05:00 UTC,
30,50154e50-81b2-3223-883b-9a5fe68807c9,04f21504-f6e4-3649-8b97-641dc522efbc,tech fetish podcast episode,http://feeds.ign.com/~r/ignfeeds/podcasts/gear/~3/mSmSpKBYeS0/Tech_Fetish_Podcast__Episode_197.mp3,2aa83278d6895c5f4934ac62bfdb17d3,amazon comixology acquisition fire tv end xp,p amazon comixology acquisition fire tv end xp ignfeed podcast,,,http://feeds.ign.com/~r/ignfeeds/podcasts/gear/~5/XJ5h3q7hyBk/Tech_Fetish_Podcast__Episode_197.mp3,25576094,audio/mpeg,,0,3197,2014-04-11 00:11:56 UTC,
31,a02541c3-ecb6-38d2-a2e0-b4d6c6e86879,fee68085-d9f1-3f1c-a8e6-5490f35e3434,tsn leafs lunch september frank seravalli,,http://iphone.tsn.ca/tsnpodcasts/LL_FrankSeravalli_September23.mp3,leafs lunch frank seravalli,,frank seravalli philadelphia daily news join leafs lunch talk flyer opening camp,TSN.ca,http://iphone.tsn.ca/tsnpodcasts/LL_FrankSeravalli_September23.mp3,4989537,audio/x-mpg,,0,285,2014-09-23 13:16:04 UTC,tsn leafs lunch frank seravalli
32,3125af39-b68b-36d8-98cb-d33be419b8b4,a4626bda-96c8-3f2e-9621-dfcfcbf9088a,episode parkrun special,http://marathontalk.libsyn.com/episode_21_the_parkrun_special,http://marathontalk.libsyn.com/index.php?post_id=620659#,last five year parkrun go friend run round bushy park saturday morning people run free every single weekend forty event time see volunteer get involve,p last five year parkrun go friend run round bushy park saturday morning people run free every single weekend forty event time see volunteer get involve w,,,http://traffic.libsyn.com/marathontalk/Ep21a_2.mp3?dest-id=18088,38559196,audio/mpeg,,0,1339,2010-06-02 04:01:00 UTC,training exercise fitness running marathon parkrun
33,545e6599-e02f-33d5-9587-e5fb6bc4ce73,51b17991-18ba-3e00-9fe8-3d022048e898,return national lampoon comedy tony hendra,http://wordballoon.libsyn.com/the-return-of-national-lampoon-comedy-with-tony-hendra,14edbf9dd5919a92d72291e3daa18c2e,comedy legend tony hendra join we might remember tony good ian spinal tap cricket bat welding manager long history comedy start writing partner monty python member graham chapman tony spend year,p comedy legend tony hendra join we might remember tony good ian spinal tap cricket bat welding manager long history comedy start writing partner monty python member graham chapman tony spend year work na,,,http://traffic.libsyn.com/wordballoon/wbTonyHendraLampoon1016.mp3?dest-id=12360,33019238,audio/mpeg,,0,3302,2016-10-03 15:45:35 UTC,
34,50ec2b75-6613-32b8-9574-3ecbc1bb3d6d,d8364f8b-a725-3ca3-b898-eb8e6ac2517c,striking prisoner speak can big pharma vote,http://weactradio.weactradio.libsynpro.com/a-striking-prisoner-speaks-ca-s-big-pharma-vote,5e4de008fb9687de3748c89d61e600c0,dee prisoner carolina area speak prison worker strike go right oppress worker demand garry south carville california tell we yes prop ballot measure,prisoner carolina area speak prison worker strike go right oppress worker p p garry south carville california tell we yes prop ballot,,,http://traffic.libsyn.com/weactradio/20160917-HOUR3_mixdown.mp3?dest-id=89231,48081668,audio/mpeg,,0,2404,2016-09-17 16:30:00 UTC,
