,id,show_id,title,link,guid,subtitle,description,summary,author,audio_url,audio_file_size,audio_mime_type,category,explicit,length,pub_date,keywords
530,970d800f-68ea-3195-a463-2b6c3bb4e4c3,971cc35f-89c1-3155-87eb-24cc1d31f2d3,angry little voice,http://blog.ringtonefeeder.com/,rtf138-speedy-harmonica,angry little voice video introduce ringtone week geoff smith,p video introduction ringtone week geoff smith p week ringtone title angry little voice tick tock p hello br br br br talkin br br,video introduction ringtone week geoff smith week ringtone title angry little voice tick tock groove hello hello pick hey talkin yeah alright know hear like invisible anything hello come make jump put phone make answer go to give count three one two oh voice mail know many choice choose ringtone thank fly get cool iphone ringtone today late news look ringtonefeeder blog follow we twitter,RingtoneFeeder.com,http://traffic.libsyn.com/gskl/rtf101129angry.mp4,12271089,video/mp4,,0,73,2010-11-30 09:24:47 UTC,ringtone ringtone ring tone geoff smith iphone video demo smart playlist ringtonefeed
531,73de8521-a7b6-36ba-a87f-8efcb3f75e93,d7c6d13e-a6db-3dd3-b7e8-0b78daaf8550,,http://podcast.tech-talk-with-craig-peterson.com/index.php?id=3284,http://podcast.tech-talk-with-craig-peterson.com/index.php?id=3284,craig discuss end microsoft support xp office mazda fuel tank spider infestation,discuss end microsoft support xp office mazda fuel tank spider talk craig pod mi,craig discuss end microsoft support xp office mazda fuel tank spider infestation,Craig,http://podcast.tech-talk-with-craig-peterson.com/pod/TTWCP-759-05-microsoft_support_for_xp_office_2013-mazda_spider_infestation.mp3,18874368,audio/mpeg,Education,0,961,2014-04-18 05:32:00 UTC,business technology science amp medicine education
532,be3e766f-3c19-3a26-892f-e2a869e94e1d,2f2f985b-9e27-37fb-a2c4-064f80ae6a48,가습기 보고서 조작 의혹 살인자에 시간만 준 꼴,,http://provider.cbspodcast.com/cgi-bin/podcast.fcgi/cbsaod/newshow/20160404_newsshow7.mp3,,,가습기 보고서 조작 의혹 살인자에 시간만 준 꼴 최예용 환경보건센터 센터장 방송 cbs 라디오 fm 진행 김현정 앵커 대담 지금부터 저희가 짧게 전해드릴 내용은 얼마 전 뉴스로 가습기 살균제 사건의 내용을 알려드렸었는데 그 후속보도가 되겠습니다 이런 사실이 밝혀졌습니다 옥시메킷사가 제출한 서울대 연구팀의 연구의 보고서가 옥시 측에 유리하게 조작됐을 가능성을 포착했다는 겁니다 이게 도대체 무슨 얘기인지 확인을 하고 가죠 환경보건시민세트 최예용 소장 연결이 돼 있습니다 소장님 나와계세요,CBS,http://provider.cbspodcast.com/cgi-bin/podcast.fcgi/cbsaod/newshow/20160404_newsshow7.mp3,5545984,audio/mpeg,,0,346,2016-04-04 07:05:00 UTC,
533,7e3218c3-9f66-3e8e-a495-211b88bfa807,f8443a15-1308-3bf4-ab2f-6caf04269991,pregame preakness podcast rob crowne,http://pregame1.libsyn.com/pregame_preakness_podcast_with_rob_crowne,http://pregame1.libsyn.com/index.php?post_id=479284#,horse racing expert rob crowne marco preview preakness,horse racing expert rob crowne marco preview preakness,,,http://traffic.libsyn.com/pregame1/Preakness_with_Rob_Crowne.mp3?dest-id=23478,32196986,audio/mpeg,,0,2012,2009-05-15 18:06:00 UTC,
534,7e338e0b-023a-3a93-b6b2-114cebdb8fa8,cf257807-0617-3dd9-84e4-792fde3ee4be,episode cue somber music,http://www.nintendoworldreport.com/rfn/18237,"""http://www.nintendoworldreport.com/podcast/nwrpodcast142.m4a""",,feature ul li super metroid li trace history cult hit revere li share experience dark cavern li explore legacy impact,feature super metroid anniversary trace history cult hit revere classic share experience dark cavern zebe explore legacy impact gaming,NintendoWorldReport.com,http://dts.podtrac.com/redirect.m4a/www.nintendoworldreport.com/podcast/nwrpodcast142.m4a,82532365,audio/mp4a-latm,,1,250,2009-04-19 14:40:00 UTC,nintendo wii nintendo ds game videogame video game gamecube nintendo world report nintendo planet gamecube nintendoworldreport
535,4efc5ae6-709a-3104-923d-662946c838e6,ad15807a-1b55-3ff6-b60f-146acdd9b011,learn language success,http://media.terri.com/tsfmvideo/podcast446.mp4,AB1B41EB-E429-4B0F-BC0F-9B954EA1A671,positive declaration weight loss,get go today terri help discover change say change life profound way,get go today terri help discover change say change life profound way,,http://media.terri.com/tsfmvideo/podcast446.mp4,177346563,video/mp4,Christianity,0,492,2016-10-24 14:27:45 UTC,
536,09a3e8de-d29e-3dee-9652-ac4df5936b45,0483708d-5bff-3ce1-b752-2811b93162b9,one child miracle cancer drug hard come,http://www.wnyc.org/story/maybe-miracle/,http://www.wnyc.org/story/maybe-miracle/,,one child miracle cancer drug hard come,p treating cancer race time every drug development promising patient plead pharmaceutical company gain access fda p happen new class drug call immunotherapy drug treatment harness immune system fight p kathy liu first hear immunotherapy year ago conference focus rare renal cancer year old son joey fight liu son cancer tumor analyze indeed seem like candidate desperate contact drug company tell wnyc tell understand policy understand regulation understand risk child time wait p listen challenge face family caregiver try save die p see picture joey family website meet p series produce weta whose documentary burns present cancer emperor air pbs,,http://www.podtrac.com/pts/redirect.mp3/audio.wnyc.org/news/news20150209_cms421774_pod.mp3,0,audio/mpeg,news,0,663,2015-02-09 16:00:00 UTC,
537,5adf25a9-1e64-3d3a-aead-9ab397f105fc,faa24c4d-de29-3baa-929a-79360cf505e6,episode fringworthy coptic menace part,http://tritacsystems.podbean.com/e/episode-291-fringworthy-the-coptic-menace-part-2/,http://tritacsystems.podbean.com/e/episode-291-fringworthy-the-coptic-menace-part-2/,week follow examination portal continued depth discussion menace present coptic,week follow examination portal continued depth discussion menace present,week follow examination portal continued depth discussion menace present coptic,Tri Tac Systems,http://tritacsystems.podbean.com/mf/feed/p4iau5/episode_291_tts_podcast_coptics_part1.mp3,50534235,audio/mpeg,Fringeworthy,0,3159,2015-09-13 23:55:00 UTC,
538,c156d059-92d3-336c-bd45-40516546e3cf,74c9a728-58c9-3277-b0c0-998c6e523186,big boo cast episode,http://bigboo.libsyn.com/the-big-boo-cast-episode-49,7324b528a4cd196d98e5a0ac54eb4e36,well idea good time hear talk barely muster leave house summer podcast really,p well idea good time hear talk barely muster leave house summer podcast p really lea,,,http://www.podtrac.com/pts/redirect.mp3/traffic.libsyn.com/bigboo/thebigboocastjune23.mp3?dest-id=35791,28347164,audio/mpeg,,0,3543,2015-06-24 03:00:00 UTC,
539,4527ab58-3c93-3b89-8870-b8ab030efdce,3816a210-ced4-3f24-b8a0-253372a12f9e,today top morning call,,http://www.ubspodcast.ch/us/wmr/podcast/en/topofthemorning/161019-TOTM_Call_Podcast.mp3,update economy case december rate hike brian rose economist,today turn focus economy guest recap recent data point speak overall economic condition impact current election cycle expectation fed policy balance year,today turn focus economy guest recap recent data point speak overall economic condition impact current election cycle expectation fed policy balance year,Anthony Pastore,http://www.ubspodcast.ch/us/wmr/podcast/en/topofthemorning/161019-TOTM_Call_Podcast.mp3,3571098,audio/mpeg,,0,594,2016-10-19 14:43:00 UTC,investment research strategy analysis market market economic top morning macro ubs portfolio
540,3b9dedab-5e56-30c8-9fc4-5c66e888b050,fdf1cb51-d18d-3a8e-b5c7-c30f252e4647,episode josh jenny solar,http://loveumentary.com/episode-78-with-josh-and-jenny-solar/,http://loveumentary.com/?p=4495,,p post josh jenny josh jenny appear first,,Nate Bagley,http://media.blubrry.com/loveumentary/traffic.libsyn.com/loveumentary/77_-_Josh_and_Jenny_Solar.mp3,17126816,audio/mpeg,Podcast Episode,0,2132,2015-12-24 10:30:18 UTC,
541,0421dbbe-eacf-36af-af4b-60005bcd260d,742f5037-276c-3410-8ad2-e0207ded5220,gtst episode coaching,http://www.tripodbroadcasting.com/2015/02/26/gtst-episode-59-the-coaching/,http://www.tripodbroadcasting.com/?p=644,open talk seinfeld whether show seinfeld funny talk matt place hierarchy tripod broadcasting network meeting discuss matt performance house card fangirle,open talk seinfeld whether show seinfeld funny talk place hierarchy tripod broadcasting network meeting discuss performance house card,open talk seinfeld whether show seinfeld funny talk matt place hierarchy tripod broadcasting network meeting discuss matt performance house card fangirle discussion possible ending season come friday also talk chicago police department shadow site interrogation detainment sort record also talk prison uprising texas,Tripod Broadcasting,http://media.blubrry.com/givethatsomethought/s3.amazonaws.com/tripodbroadcasting/podcasts/GTST/GTST_59.mp3,50535500,audio/mpeg,Starbucks CEO,0,3101,2015-02-26 18:47:39 UTC,
542,679ff73b-6ee0-3a3d-a292-183f78b6732f,29a6d896-5e7d-386c-b1ab-0468ce56a1b2,april monday week easter,http://hermitinthecity.libsyn.com/april_12_monday_of_the_2nd_week_of_easter,http://hermitinthecity.libsyn.com/index.php?post_id=598707#,act one see rule god unless begotten prince conspire together lord anointed tell,act one see rule god unless begotten prince conspire together lord anointed tell psalm well first reading rule shall,,,http://traffic.libsyn.com/hermitinthecity/BC-041612-M_2_E.mp3?dest-id=17188,4845067,audio/mpeg,,0,296,2015-04-12 16:00:00 UTC,
543,a4b7613b-ffef-34b6-a703-b4654a3d421a,51195d47-47a6-3727-8f44-ef167549a898,oldie goody,http://traffic.libsyn.com/oldies/CSshow313hr1.mp3,4c4300a329294cc349ff1d89b7f9aa60,oldie goody doo wop good youthful year early rock n roll oldtimeradiod,p oldie goody doo wop good youthful year early rock n roll,,,http://traffic.libsyn.com/oldies/CSshow313hr1.mp3?dest-id=3501,1729812,audio/mpeg,,0,72,2012-11-18 06:00:00 UTC,oldie
544,5e4e8490-4bd5-3a6e-906c-d556aa8d593c,081f9cad-d7d0-3251-9488-af8f099f2ef8,keith dowman dream dzogchen,http://annehill.org/2012/08/29/keith-dowman-on-dreams-and-dzogchen/,http://annehill.org/?p=840,speak dzogchen teacher author translator tibetan buddhist scholar keith dowman dream dzogchen among topic find talk awaken state dream state deep sleep dream analogue,p speak dzogchen teacher author translator tibetan buddhist scholar dowman website dream dzogchen among topic find p,speak dzogchen teacher author translator tibetan buddhist scholar keith dowman dream dzogchen among topic find talk awaken state dream state deep sleep dream analogue awakened state lucid dream intensity light dream content vajrayana dzogchen nightmare equanimity precognitive dream dzogchen vajrayana dream skillful mean lucid dream rehearsal cross focus light dream self awareness dream,"Anne Hill, D.Min.",http://annehill.org/podpress_trac/feed/840/0/KeithDowmanDTR120828.mp3,22160144,audio/mpeg,Vajrayana Buddhism,0,1376,2012-08-29 15:32:31 UTC,audio
545,7e97f765-8666-39fd-8141-cc7e4fd1ffea,7fc601f8-7954-3b9b-9dd7-bfa32b0b9728,episode basement,http://nightlightstories.libsyn.com/episode-56-the-basement,ce36a7230e44ae070434638903afbfe4,boy work keep imagination get good order complete chore mother,p boy work keep imagination get good order complete chore,,,http://traffic.libsyn.com/nightlightstories/TheBasementfinal.mp3?dest-id=36561,16043474,audio/mpeg,,0,987,2013-03-27 01:28:31 UTC,fiction fear child terror courage brave basement afraid scared cellar kidlit
546,e72cf1c4-3b23-3e41-bae9-5e0aa747cace,ea1cfdbb-3a10-300f-b0ac-85516a4dba40,wttm christmas world winter fantasy color dream,http://pbarrie.libsyn.com/wttm-458-a-christmas-world-of-winter-fantasy-colored-dreams,04184e0b781ed04029aa7701d311ceea,contact we,p contact we br br,,,http://traffic.libsyn.com/clean/pbarrie/WTTM_458_xmas.mp3?dest-id=12109,114478849,audio/mpeg,,0,1274,2014-12-15 08:30:00 UTC,
547,09bb7a6b-8dc7-3c7d-b4af-219e2f526fdb,b364dc25-f5b4-30dd-9102-4e1a6a739a95,lhs episode king jeremy wicked,http://lhspodcast.info/2012/07/lhs-episode-087-king-jeremy-the-wicked/,http://lhspodcast.info/?p=2387,hello listener welcome installment linux ham shack past couple episode full interview logic information short totally jump normal bandwagon order fix put,p hello listener welcome installment linux ham shack past couple episode full interview logic information short totally jump normal bandwagon order fix put toge,hello listener welcome installment linux ham shack past couple episode full interview logic information short totally jump normal bandwagon order fix put together episode contain lot banter insight musing laugh music good time somewhere middle find information linux open source software ham radio logging application answer listener feedback compile instruction source build mention secret recording russ take another podcast rule world make sure listen begin end go want miss single second de lhs guy,Russ (K5TUX),http://lhspodcast.info/podpress_trac/feed/2387/0/lhs087.mp3,42669432,audio/mpeg,YFKtest,0,1850,2012-07-28 21:57:18 UTC,
548,03a77a2e-0152-3556-ae79-ce39cfb6d198,2328b371-753a-35ac-baac-bbc2b68f950c,around hub season episode,http://www.wdwntunes.com/podcast/around-the-hub-season-2-episode-14/,http://www.wdwntunes.com/podcast/?p=294,around hub game show base espn around horn four contestant around wdwnt network podcast match wit game competitive banter point award good argument point may deduct podcast,around hub game show base around horn four contestant around wdwnt network podcast match wit game competitive banter point award good argument point may deduct podcaster los,around hub game show base espn around horn four contestant around wdwnt network podcast match wit game competitive banter point award good argument point may deduct podcaster lose train thought say something host agree round play start rope drop cover big news story week entire walt disney company end face last two podcaster stand end round podcaster low point total eliminate winner episode get thirty second meet n greet discuss anything world disney mind second episode hub madness panel tackle memory maker transportation issue whole lot key kingdom face round four panelist seed tournament reimagine ride stitch,WDWNT LLC,http://www.wdwntunes.com/podcast/podpress_trac/feed/294/0/AtH_Season%202%20-%20Episode%2014.mp3,61671727,audio/mpeg,Uncategorized,0,371,2013-04-02 10:30:59 UTC,uncategorize
549,babbf221-c950-3add-a50f-6caaa742cd8d,9ae499f5-54fb-3a87-ae27-669e373aeb47,programación con arduino el paradigma de la computación física,https://www.spreaker.com/user/ldelvalleh/96-programacion-con-arduino-el-paradigma,https://api.spreaker.com/episode/9612398,en este capítulo voy hablar de la computación física desde el punto de vista de arduino para entender este concepto tenemos que ser consciente que la programación computación física involucra algo más que programar en un lenguaje de,en este capítulo voy hablar de la computación física desde el punto de vista de arduino para entender este concepto tenemos que ser consciente que la programación computación física involucra algo más que programar en un lenguaje de programación,en este capítulo voy hablar de la computación física desde el punto de vista de arduino para entender este concepto tenemos que ser consciente que la programación computación física involucra algo más que programar en un lenguaje de programación esto es una parte de esta disciplina por lo tanto se debe tratar como tal otra de las áreas involucradas dentro de la programación física es el hardware en este punto el open hardware hardware abierto juega un papel muy importante por último debemos conocer las herramientas necesarias para poder desarrollar este concepto en toda su extensión durante este artículo el capítulo del podcast que acompaña voy dar una visión general de este concepto todo lo que involucrum necesito que hagas un favor votar por programarfacil en los premios bitácoras solo te llevará minuto muchas gracia qué es la computación física se centra en diseñar dispositivos objetos e incluso entornos que permitan establecer un canal de comunicación entre el mundo físico el mundo virtual aunque esto suene algo relacionado con el futuro la realidad es que llevamos conviviendo con esta disciplina mucho tiempo solo tenemos que pensar en un ordenador en un dispositivo móvil estos dispositivos ponen en contacto nuestro mundo el mundo físico el mundo virtual de las máquinas ordenadore el diálogo se realiza través de interface hardware como un teclado ratón micrófono pantalla altavoce etc la finalidad de la computación física es diseñar estas interface para que sean capace de detectar alteracione en el medio físico traducirla señale que entiendan las máquinas esto se hace tanto través de software como de hardware en la actualidad cuando desarrollamos un software para un ordenador un dispositivo móvil estamos aplicando computación física el problema que existe es que solo tocamos una de las patas de esta disciplina las interface hardware de los dispositivos actuale nos limita la hora de diseñar software para esas interface gracias al open hardware esto está cambiando en resuman para avanzar en el mundo de la computación física necesitamos de ciertos componente hardware transductore que conviertan los cambios de energía producidos por las alteraciones en el medio físico en señale eléctrica entendible por los ordenadore máquinas aquí es donde entran en juego los sensores son los encargados de transformar una magnitud física en una señal eléctrica pero como esta comunicación es bidereccional también necesitaremos actuadore que convierten las señales eléctrica en magnitude físicas los ordenadores ya sean microprocesadore microcontroladore son los encargados del control de los sensore actuadore deben ser capace la vez de comunicar con otras máquinas para mostrar los datos en pantallas multimedia almacenar información en base de datos en la nube proceso computacion física diseño de interface hardware en la computación física como ya hemos visto una de las part importantes dentro de la computación física es el hardware aquí se involucrado tre componente de hardware nivel básico los sensores serán los encargados de detectar esa alteraciones en el medio físico transformarla en señale eléctrica tenemos como ejemplos el sensor de temperatura el que además mide la humedad dentro de esta categoría podemos encontrar también el sensor de ultrasonido hc con el que podemos hacer un sensor de nivel de agua los actuadores harán lo contrario convertir señale eléctrica en magnitude físicas que activan procesos los motores paso paso de las impresoras los relés son ejemplo de actuadores incluso un lead funciona como tal el microcontrolador será el encargado de controlar gestionar los sensore actuadore podríamos pensar en utilizar un microprocesador nos daría más potencia funcionalidade es verdad pero los,La Tecnología para todos,https://api.spreaker.com/download/episode/9612398/podcast96.mp3,0,audio/mpeg,,0,2596,2016-10-11 04:42:25 UTC,programación diy maker arduino computacion fisica
550,7b371926-5ba7-32cd-b04c-96a77f63d4c1,c13f438c-c52f-32f0-8e75-b8e5864a814d,,http://allthreepoints.libsyn.com/2015-e4,d7699546b9995ce5278ffa946eb9dbc4,clb tor,,,,http://traffic.libsyn.com/allthreepoints/All_3_Points_05_15_2015_-_Master.mp3?dest-id=134072,65595059,audio/mpeg,,0,2733,2015-05-15 15:30:00 UTC,
551,990fa95a-30a3-39be-85e1-df6ee2ad673a,29a972f7-6fa4-3ead-9955-e8e008162586,stanton warrior session podcast teaser episode,https://www.podomatic.com/podcasts/stantonwarriors/episodes/2009-04-17T10_02_58-07_00,http://stantonwarriors.podomatic.com/entry/2009-04-17T10_02_58-07_00,first ever stanton warrior stanton session podcast drop bring fresh,img ts pic first ever stanton warrior stanton session podcast drop bring fresh bassline detroit booty banger around,first ever stanton warrior stanton session podcast drop bring fresh bassline detroit booty banger around globe load burn pod plug taster come subscribe first hear future episode enjoy stanton warrior,,http://stantonwarriors.podOmatic.com/enclosure/2009-04-17T10_02_58-07_00.mp3,5761253,audio/mpeg,,0,480,2009-04-17 17:02:58 UTC,breakbeat plump stanton warrior dio online detroit heavy podcast
552,c85d357b-b3a7-33bf-ac30-d59f2c317287,dd20b190-167d-3417-a979-d89645918ed7,beauty bride,,http://media.whchurch.org/1995/1995-12-17_Boyd_The-Beauty-of-the-Bride.mp3,,want change dramatically relationship god must begin see way god see we christ holy beautiful spotless,want change dramatically relationship god must begin see way god see we christ holy beautiful spotless,Greg Boyd,http://media.whchurch.org/1995/1995-12-17_Boyd_The-Beauty-of-the-Bride.mp3,4390000,audio/mpeg,,0,2246,1995-12-17 00:00:00 UTC,woodland hills church greg boyd tear wall spiritual warfare
553,2aeaaa46-9995-3511-9ec8-9aed184d1260,4aa53438-b371-3e5f-bb59-424653576239,chapter,http://nantucket.ma.schoolwebpages.com/education/components/docmgr/default.php?sectiondetailid=3267,http://nantucket.ma.schoolwebpages.com/education/components/docmgr/default.php?sectiondetailid=3267&fid=5112,,chapter kill mockingbird disc harper lee,,Harper Lee,http://nantucket.ma.schoolwebpages.com/images/docmgr/30file5112.m4a,7983616,audio/mp4,,0,524,2012-05-04 10:15:24 UTC,
554,4f8193c4-5d4b-3657-bce3-7ab6c60c2dfd,8572fb6f-800d-3dce-9976-0c2b62faf005,blisskrieg,http://traffic.libsyn.com/djsteveboy/blisskrieg.mp3,http://traffic.libsyn.com/djsteveboy/blisskrieg.mp3,relentless onslaught positive vibe,progressive house mix build upbeat dance f look back funk root forward high tech capability playlist bit lolitas lucy iris settle score biologik sarin color ray remix jaytech wipeout,progressive house mix build upbeat dance f look back funk root forward high tech capability playlist bit lolitas lucy iris settle score biologik sarin color ray remix jaytech wipeout sasha carassi mix ethian guerrero carlos dominguez terragona meet chicago dany cohiba felix jr remix kiman egoism gantelya solarstone aly fila fireisland serhio vegas remix matt carter stack dj romy go to get well tony thomas remix gatdecor passion moss szade mix please support artist music copyright respective artist material steve boyett personal use right reserve unauthorized copying editing exhibition sale rental exchange public performance broadcast audio strictly prohibit groovelectric merch,Steve Boyett,http://traffic.libsyn.com/djsteveboy/blisskrieg.mp3,54377607,audio/mpeg,,0,3394,2013-11-02 05:00:00 UTC,house music progressive house funk tech house dj mix club music
555,688d1204-0c1b-35b0-9194-a41cbf2f5ee1,9de5bdf6-f4ff-31d6-87d7-c1506188c51b,tps barefoot fitness sock doc,http://thewellnesscouch.com/tps/tps-123-barefoot-fitness-with-the-sock-doc,http://thewellnesscouch.com/?p=8070,week brett interview dr steve gangemi aka sock doc thing functional fitness triathlon natural movement barefoot run steve share chiropractic philosophy steer direction towards natur,week brett interview dr steve gangemi aka sock doc thing functional fitness triathlon natural movement barefoot run steve share chiropractic philosophy steer direction towards natural,week brett interview dr steve gangemi aka sock doc thing functional fitness triathlon natural movement barefoot run steve share chiropractic philosophy steer direction towards natural approach health well tune awesome insight,The Wellness Couch,http://www.podtrac.com/pts/redirect.mp3/thewellnesscouch.com/wp-content/uploads/podcasts/tps/tps-123-barefoot-fitness-with-the-sock-doc.mp3,38518932,audio/mpeg,TPS,0,2124,2015-06-25 21:00:00 UTC,
556,145ae4ab-c35f-305b-87d5-cdceaba57626,f603af73-6ba6-3846-83b2-84a6b7143f52,brother righteousness,https://www.spreaker.com/user/robinlynne/the-brothers-of-righteousness,http://www.blogtalkradio.com/freedom-doors-ministries/2016/06/07/the-brothers-of-righteousness,brother righteousness godly man bro frank people bro ronald bass bro mike big man man great faith man god go way share good news jesus brother righteousness man witness,brother righteousness godly man bro frank people bro ronald bass bro mike big man man great faith man god go way share good news jesus brother righteousness man witness st,brother righteousness godly man bro frank people bro ronald bass bro mike big man man great faith man god go way share good news jesus brother righteousness man witness street need savior food clothe even shelter brother assist drug alcohol mainly anyone find way lord savior jesus son true live god think brother righteousness see other different flower need pick display almighty god flower come many shape color different name one,RobinLynne,https://api.spreaker.com/download/episode/8711837/the_brothers_of_righteousness.mp3,0,audio/mpeg,,0,5666,2016-06-07 11:00:00 UTC,frank jesus mike ronald brother righteousness
557,38b689aa-3750-37f7-8568-36f7f0f1e170,c792161f-549f-3b77-8125-0fd897128e04,week preview jet bill recap,http://aroundtheleague.libsyn.com/week-2-preview-jets-vs-bills-recap,5eab36755c18388c0091d65746b09bd6,room fill hero dan hanzus gregg rosenthal chris wesseling marc sessler go game game break week matchup pick team think lock week plus hero recap thursday,p room fill hero dan hanzus gregg rosenthal chris wesseling marc sessler go game game break week matchup pick team think lock week plus hero recap thursday night matchup,,,http://traffic.libsyn.com/aroundtheleague/150916_ATN_Audio.mp3?dest-id=154040,79470079,audio/mpeg,,0,1485,2016-09-16 04:18:13 UTC,
